add,bath,bed,car,desc,features,headline,id,lat,lon,photo,postcode,price,street,suburb,type,url,url2,date,min_price,max_price
"Level 13/88 Church street, Parramatta",2.0,2.0,1,"<b></b><br />This bright north-east facing two-bedroom plus study West Village apartment offers qualities, space and convenience; only a short walk to Parramatta train station and CBD. The large balcony in the apartment plus Podium garden and BBQ areas...","['AirConditioning', 'Ensuite', 'Floorboards', 'Gas', 'InternalLaundry', 'SecureParking', 'Intercom', 'Dishwasher', 'Study', 'GardenCourtyard', 'BalconyDeck']",Brand New Urban Lifestyle in Prime Location,2016288610.0,-33.8199348,151.004,https://bucket-api.domain.com.au/v1/bucket/image/2016288610_1_1_200601_041239-w3264-h2448,2150,Contact Agent for Price,Church street,PARRAMATTA,ApartmentUnitFlat,https://www.domain.com.au/level-13-88-church-street--parramatta-2150-2016288610,https://www.domain.com.au/level-13-88-church-street-parramatta-nsw-2150-2016288610,2021-07-10,,
"1108/330 Church Street, Parramatta",2.0,2.0,1,<b></b><br />Located in the sort after Altitude building is this beautifully presented apartment captures endless natural light and magnificent sweeping views. An inspired design offers a combined living/dining/kitchen area. Opening onto a north/west -...,"['AirConditioning', 'BuiltInWardrobes', 'Ensuite', 'Gas', 'InternalLaundry', 'PetsAllowed', 'SecureParking', 'SwimmingPool', 'IndoorSpa', 'Gym', 'Intercom', 'Bath', 'Dishwasher', 'BalconyDeck']",TWO BEDROOM APARTMENT ENJOYS THE PRIME PARRAMATTA CBD LOCATION,2016285789.0,-33.81145,151.00502,https://bucket-api.domain.com.au/v1/bucket/image/2016285789_1_1_200529_044824-w1920-h1439,2150,$745000  NO OPEN  FOR INSPECTION DUE TO COVID.,Church Street,PARRAMATTA,ApartmentUnitFlat,https://www.domain.com.au/1108-330-church-street--parramatta-2150-2016285789,https://www.domain.com.au/1108-330-church-street-parramatta-nsw-2150-2016285789,2021-07-10,745000.0,745000.0
"2608/45 Macquarie Street, Parramatta",2.0,2.0,1,"<b></b><br />**DAILY PRIVATE INSPECTIONS AVAILABLE**

Embracing panoramic north east facing views, this ultra contemporary apartment is located on the 26th floor of the coveted 'V by Crown' complex. It offers luxurious resort style living in the heart ...","['AirConditioning', 'BuiltInWardrobes', 'Ensuite', 'Gas', 'SwimmingPool', 'CityViews', 'Gym', 'AlarmSystem', 'Intercom', 'Bath']",Stunning two bedroom apartment on Level 26  V By Crown Parramatta,2016145325.0,-33.81484,151.001251,https://bucket-api.domain.com.au/v1/bucket/image/2016422292_1_1_200805_111701-w800-h600,2150,"Buyers Guide  $800,000 - $850,000",Macquarie Street,PARRAMATTA,ApartmentUnitFlat,https://www.domain.com.au/2608-45-macquarie-street--parramatta-2150-2016145325,https://www.domain.com.au/2608-45-macquarie-street-parramatta-nsw-2150-2016145325,2021-07-10,800000.0,850000.0
"3605/330 Church Street, Parramatta",2.0,2.0,1,"<b></b><br />Inspections by appointment only. Please contact our friendly sales team to book a suitable time. Strictly 1 person at a time and please wear your mask.

Panoramic city views star in this quality designer apartment that offers a vibrant e...","['AirConditioning', 'BuiltInWardrobes', 'Ensuite', 'Floorboards', 'SecureParking', 'CityViews', 'Bath', 'Study', 'BalconyDeck']",EXECUTIVE CITY APARTMENT FEATURES INCREDIBLE CBD VIEWS,2016039481.0,-33.81145,151.00502,https://bucket-api.domain.com.au/v1/bucket/image/2016039481_1_1_200129_101019-w1920-h1280,2150,Contact Agent,Church Street,PARRAMATTA,ApartmentUnitFlat,https://www.domain.com.au/3605-330-church-street--parramatta-2150-2016039481,https://www.domain.com.au/3605-330-church-street-parramatta-nsw-2150-2016039481,2021-07-10,,
"2/21-23 Queens Road, Westmead",2.0,3.0,2,"<b></b><br />Inspections by appointment only. Please contact our friendly sales team to book a suitable time. Strictly 1 person at a time and please wear your mask.

Privately positioned on the top floor of a well-maintained small security block, thi...","['BuiltInWardrobes', 'Ensuite', 'Gas', 'InternalLaundry']",WHEN LOCATION AND SIZE MATTERS,2017126285.0,-33.8064461,150.990784,https://bucket-api.domain.com.au/v1/bucket/image/2017126285_1_1_210710_043730-w1500-h1000,2145,JUST LISTED,Queens Road,WESTMEAD,ApartmentUnitFlat,https://www.domain.com.au/2-21-23-queens-road--westmead-2145-2017126285,https://www.domain.com.au/2-21-23-queens-road-westmead-nsw-2145-2017126285,2021-07-10,,
"5A DAFFODIL STREET, Greystanes",3.0,4.0,1,"<b></b><br />Situated in popular Greystanes this brand new duplex is only minutes away from schools, shopping, parks and buses. 
An outstanding construction with high end finishes, and one of the best duplexes you can find ! 

With a stunning polyureth...","['AirConditioning', 'BuiltInWardrobes', 'Ensuite', 'Gas', 'SecureParking', 'AlarmSystem', 'Intercom', 'Heating', 'Dishwasher', 'Study']",ABSOLUTELY REMARKABLE BRAND NEW,2017123667.0,-33.83516,150.9478,https://bucket-api.domain.com.au/v1/bucket/image/2017123667_1_1_210708_114252-w6006-h4002,2145,FOR SALE BY NEGOTIATION,DAFFODIL STREET,GREYSTANES,House,https://www.domain.com.au/5a-daffodil-street--greystanes-2145-2017123667,https://www.domain.com.au/5a-daffodil-street-greystanes-nsw-2145-2017123667,2021-07-10,,
"1/27-29 Tungarra Road, Girraween",3.0,3.0,1,"<b></b><br />**Due to the current Covid lockdown all inspections will be conducted by private appointment until 10th July or until we are informed otherwise by NSW Health.**

Brand new architecturally designed townhouse showcasing an enviable lifestyle...","['AirConditioning', 'BuiltInWardrobes', 'Ensuite', 'Floorboards', 'Gas', 'Dishwasher']",Brand New 3 Bedroom Townhouse,2017122603.0,-33.7969437,150.948853,https://bucket-api.domain.com.au/v1/bucket/image/2017122603_1_1_210708_060115-w1200-h800,2145,Contact Agent,Tungarra Road,GIRRAWEEN,Townhouse,https://www.domain.com.au/1-27-29-tungarra-road--girraween-2145-2017122603,https://www.domain.com.au/1-27-29-tungarra-road-girraween-nsw-2145-2017122603,2021-07-10,,
"8/100 Kenyons  Road, Merrylands",2.0,4.0,2,"<b></b><br />This is your opportunity to own the only villa in all of Sherwood Green. With it's own private and low maintenance backyard, the property sits just beside the native nature reserve that provides a bush-like atmosphere, with shade in the su...","['AirConditioning', 'BuiltInWardrobes', 'Ensuite', 'Gas', 'InternalLaundry', 'PetsAllowed', 'SecureParking', 'Heating', 'Dishwasher']",333 SQM: Unique Villa with Private Yard and Northern Exposure,2017117087.0,-33.8373,150.969421,https://bucket-api.domain.com.au/v1/bucket/image/2017117087_1_1_210706_070950-w4000-h2667,2160,"$748,000 | 333sqm",Kenyons  Road,MERRYLANDS,Villa,https://www.domain.com.au/8-100-kenyons--road--merrylands-2160-2017117087,https://www.domain.com.au/8-100-kenyons-road-merrylands-nsw-2160-2017117087,2021-07-10,748000.0,748000.0
Pemulwuy,2.0,4.0,2,"<b></b><br />ABOUT RIVERBANK
Riverbank Real Estate is located within the ever-popular Pemulwuy estate. Having serviced the Pemulwuy market since 2006, we aim to invest the time upfront to understand your needs to ensure we turn your vision and dream in...",['Furnished'],REGISTER YOUR INTEREST BY WAY OF EXPRESSIONS OF INTEREST,2017116927.0,-33.817,150.926,https://bucket-api.domain.com.au/v1/bucket/image/2017116927_1_1_210706_071223-w1579-h1054,2145,House & Land Packages,,PEMULWUY,NewHouseLand,https://www.domain.com.au/pemulwuy-2145-2017116927,https://www.domain.com.au/pemulwuy-nsw-2145-2017116927,2021-07-10,,
"45 HANBURY STREET, Greystanes",3.0,4.0,1,"<b></b><br />Enhanced by a sunny north east aspect, this sensational double story home provides an unmissable opportunity for your family in a premier enclave of Greystanes

 This cement -rendered brick home sits high and proud, with features such as: ...","['AirConditioning', 'BuiltInWardrobes', 'Ensuite', 'Gas', 'SecureParking', 'SwimmingPool', 'Shed']",FANTASTIC FAMILY HOME WITH INGROUND POOL,2017112758.0,-33.8242455,150.956284,https://bucket-api.domain.com.au/v1/bucket/image/2017112758_1_1_210705_020750-w6002-h4002,2145,FOR SALE BY NEGOTIATION,HANBURY STREET,GREYSTANES,House,https://www.domain.com.au/45-hanbury-street--greystanes-2145-2017112758,https://www.domain.com.au/45-hanbury-street-greystanes-nsw-2145-2017112758,2021-07-10,,
"14 Binda Street, Merrylands",3.0,4.0,1,"<b></b><br />PROPERTY LAUNCH - ALL OFFERS MUST BE SUBMITTED BY 5PM SATURDAY 17TH JULY 2021

Boasting a stylishly modern presentation with lovely easy-care tiled flooring, energy efficient LED lighting and ducted air-conditioning throughout, this fabulo...","['AirConditioning', 'BuiltInWardrobes', 'Ensuite', 'Gas', 'InternalLaundry', 'SecureParking', 'Heating']",DELIGHTFUL DESIGNER DUPLEX,2017112302.0,-33.83428,150.9731,https://bucket-api.domain.com.au/v1/bucket/image/2017112302_1_1_210705_121221-w750-h500,2160,"Price Guide: $890,000 - $930,000",Binda Street,MERRYLANDS,House,https://www.domain.com.au/14-binda-street--merrylands-2160-2017112302,https://www.domain.com.au/14-binda-street-merrylands-nsw-2160-2017112302,2021-07-10,890000.0,930000.0
"11/221A North Rocks Road, North Rocks",2.0,3.0,1,"<b></b><br />Townhouses of this size and in this location rarely come on the market.

Situated in the peaceful Banksia Court Estate which provides exclusive use and access to pool and recreational facilities. 

This delightful split level townhouse is ...","['AirConditioning', 'BuiltInWardrobes', 'Floorboards', 'Gas', 'SecureParking', 'SwimmingPool', 'Furnished', 'Study', 'FullyFenced']",Large Stylish Townhouse in Sought After Estate,2017113560.0,-33.7730255,151.016418,https://bucket-api.domain.com.au/v1/bucket/image/13169725_1_1_190506_033700-w736-h550,2151,Auction,North Rocks Road,NORTH ROCKS,Townhouse,https://www.domain.com.au/11-221a-north-rocks-road--north-rocks-2151-2017113560,https://www.domain.com.au/11-221a-north-rocks-road-north-rocks-nsw-2151-2017113560,2021-07-10,,
"5A Rein Road, Greystanes",3.0,3.0,2,<b></b><br />Sitting high and proud in a fantastic location is this perfect opportunity for you to finally jump into the Greystanes property market. This oversized 3 bedroom Torrens title duplex is sure to impress and make a great first start or invest...,"['AirConditioning', 'BuiltInWardrobes', 'Gas', 'SecureParking', 'Intercom', 'Bath', 'Dishwasher']","$880,000 - $920,000 - WELCOME TO GREYSTANES - BOOKINGS ARE ESSENTIAL!!!",2017113471.0,-33.82493,150.961655,https://bucket-api.domain.com.au/v1/bucket/image/2017113471_1_1_210705_045417-w1920-h1280,2145,"$880,000 - $920,000 WELCOME TO GREYSTANES",Rein Road,GREYSTANES,House,https://www.domain.com.au/5a-rein-road--greystanes-2145-2017113471,https://www.domain.com.au/5a-rein-road-greystanes-nsw-2145-2017113471,2021-07-10,880000.0,920000.0
"2/12 Bradman Street, Merrylands",3.0,3.0,2,"<b></b><br />Nestled in an attractive complex, this townhouse is set over three levels, conveniently located within walking distance to most amenities and is a great opportunity for those looking to secure their first home, retirees wanting to downsize...","['AirConditioning', 'BuiltInWardrobes', 'Ensuite', 'Gas', 'AlarmSystem', 'Intercom', 'Dishwasher']","295 sqm | Tri Level, Rare Find - Affordable & Convenient",2017111016.0,-33.8429871,151.001572,https://bucket-api.domain.com.au/v1/bucket/image/2017111016_2_1_210702_074028-w1600-h1068,2160,Inspect Sat 3:00 - 3:30pm,Bradman Street,MERRYLANDS,Townhouse,https://www.domain.com.au/2-12-bradman-street--merrylands-2160-2017111016,https://www.domain.com.au/2-12-bradman-street-merrylands-nsw-2160-2017111016,2021-07-10,,
"10/2-4 Water Street, Wentworthville",2.0,3.0,1,"<b></b><br />Set in a near new modern complex, this easy care designer townhouse offers a deluxe private lifestyle with two levels of practical living space, featuring:

-        3 spacious bedrooms with built in robes and 2 full bathrooms
-       Gour...","['AirConditioning', 'Gas', 'AlarmSystem', 'Intercom', 'Heating', 'Dishwasher']",By Appointment this Saturday from 11am - 12pm,2017109511.0,-33.8044,150.974487,https://bucket-api.domain.com.au/v1/bucket/image/2017109511_1_1_210702_015544-w3556-h2667,2145,"$790,000 to $830,000",Water Street,WENTWORTHVILLE,Townhouse,https://www.domain.com.au/10-2-4-water-street--wentworthville-2145-2017109511,https://www.domain.com.au/10-2-4-water-street-wentworthville-nsw-2145-2017109511,2021-07-10,790000.0,830000.0
"21/221A North Rocks Road, North Rocks",2.0,3.0,2,"<b></b><br />By Appointment Inspections Available

Private, comfortable and spacious living is guaranteed for the lucky new owners of this three-bedroom, two-bathroom North Rocks townhouse. You will live just 10 minutes from the Parramatta CBD with sch...","['AirConditioning', 'BuiltInWardrobes', 'Ensuite', 'Floorboards', 'Gas', 'SecureParking', 'Heating', 'Dishwasher', 'FullyFenced']",Large 2-storey townhouse in a quiet community,2017104118.0,-33.7730255,151.016418,https://bucket-api.domain.com.au/v1/bucket/image/2017104118_1_1_210630_032144-w2100-h1400,2151,"Guide $850,000",North Rocks Road,NORTH ROCKS,Townhouse,https://www.domain.com.au/21-221a-north-rocks-road--north-rocks-2151-2017104118,https://www.domain.com.au/21-221a-north-rocks-road-north-rocks-nsw-2151-2017104118,2021-07-10,850000.0,850000.0
"35 Warwick Rd, Merrylands",3.0,4.0,1,"<b></b><br />ATTENTION: Private Inspections (Sat 10.30-11.00am) available during the times specified, please be patient with our agents as they accommodate each inspection following Covid-19 health and safety procedures. We thank you for your cooperati...","['AirConditioning', 'BuiltInWardrobes', 'SecureParking', 'Furnished', 'GroundFloor', 'NorthFacing', 'AlarmSystem', 'Intercom']",Double brick | Luxury | Lifestyle,2017103936.0,-33.83175,150.985031,https://bucket-api.domain.com.au/v1/bucket/image/2017103936_1_1_210630_024229-w1600-h1200,2160,Auction,Warwick Rd,MERRYLANDS,House,https://www.domain.com.au/35-warwick-rd--merrylands-2160-2017103936,https://www.domain.com.au/35-warwick-rd-merrylands-nsw-2160-2017103936,2021-07-10,,
"3/15 Governors Way, Oatlands",2.0,3.0,2,"<b></b><br />Perfectly positioned in the sought-after Hunterford Estate, this quality apartment impresses with two private balconies and lush outlooks over the complex's on site facilities. It's located just moments from Oatlands Golf Course, buses and...","['AirConditioning', 'BuiltInWardrobes', 'Ensuite', 'Floorboards', 'PetsAllowed', 'SecureParking', 'SwimmingPool', 'Intercom', 'Bath', 'Dishwasher']",Quality apartment in exclusive Hunterford Estate,2017102735.0,-33.78919,151.025253,https://bucket-api.domain.com.au/v1/bucket/image/2017102735_1_1_210629_074459-w1600-h1200,2117,Auction,Governors Way,OATLANDS,ApartmentUnitFlat,https://www.domain.com.au/3-15-governors-way--oatlands-2117-2017102735,https://www.domain.com.au/3-15-governors-way-oatlands-nsw-2117-2017102735,2021-07-10,,
"58 Macquarie Road, Greystanes",4.0,4.0,1,"<b></b><br />Having been completely renovated and stylishly updated, this fabulous single level home presents a beautiful contemporary lifestyle for its new owners. The fresh floorplan offers plenty of flexibility inclusive of a separate self-contained...","['AirConditioning', 'BuiltInWardrobes', 'SecureParking']",FRESHLY UPDATED AND EXPANDED,2017101437.0,-33.832058,150.9449,https://bucket-api.domain.com.au/v1/bucket/image/2017101437_1_1_210629_032144-w750-h500,2145,"AUCTION - BIDDING GUIDE $950,000",Macquarie Road,GREYSTANES,House,https://www.domain.com.au/58-macquarie-road--greystanes-2145-2017101437,https://www.domain.com.au/58-macquarie-road-greystanes-nsw-2145-2017101437,2021-07-10,950000.0,950000.0
"3 Bowden Street, Merrylands",3.0,4.0,1,"<b></b><br />PROPERTY LAUNCH - ALL OFFERS MUST BE SUBMITTED BY 5PM SATURDAY 10TH JULY 2021

Having been carefully refreshed with lovely fresh paint, new bathroom fittings and beautiful tiled flooring through the downstairs living area, this fabulously ...","['AirConditioning', 'BuiltInWardrobes', 'Ensuite', 'Gas', 'InternalLaundry', 'SecureParking', 'Intercom', 'Study']","REFRESHED, REVITALISED AND READY",2017099760.0,-33.8431625,150.9725,https://bucket-api.domain.com.au/v1/bucket/image/2017099760_1_1_210628_064152-w750-h499,2160,"Price Guide $880,000 - $930,000",Bowden Street,MERRYLANDS,House,https://www.domain.com.au/3-bowden-street--merrylands-2160-2017099760,https://www.domain.com.au/3-bowden-street-merrylands-nsw-2160-2017099760,2021-07-10,880000.0,930000.0
"64 Paton Street, Merrylands",2.0,4.0,1,"<b></b><br />Presented in clean and fresh condition with stylish easy-care tiled flooring throughout, this family home is filled with fabulous extras for a lifestyle of exceptional security and comfort. The bright residence offers four bedrooms, three ...","['AirConditioning', 'BuiltInWardrobes', 'Gas', 'InternalLaundry']",PACKED WITH EXTRAS,2017099514.0,-33.83474,150.965515,https://bucket-api.domain.com.au/v1/bucket/image/2017099514_1_1_210628_055154-w750-h499,2160,AUCTION,Paton Street,MERRYLANDS,House,https://www.domain.com.au/64-paton-street--merrylands-2160-2017099514,https://www.domain.com.au/64-paton-street-merrylands-nsw-2160-2017099514,2021-07-10,,
"6 Archibald Street, Granville",2.0,4.0,4,"<b></b><br />Ticking all the right boxes this 30 year old ""Masterton"" built brick veneer home is located in a quiet street on the high side of the road on a 487sqm block of land.  Ideal for a granny flat build subject to Council approval.

Only 700m wa...","['BuiltInWardrobes', 'Ensuite', 'Gas', 'InternalLaundry', 'SecureParking', 'Heating']",BRICK  WALK TO STATION  487sqm BLOCK,2017098585.0,-33.84035,151.013458,https://bucket-api.domain.com.au/v1/bucket/image/2017098585_1_1_210628_024131-w1920-h1280,2142,BRICK – WALK TO STATION – 487sqm BLOCK,Archibald Street,GRANVILLE,House,https://www.domain.com.au/6-archibald-street--granville-2142-2017098585,https://www.domain.com.au/6-archibald-street-granville-nsw-2142-2017098585,2021-07-10,,
"1/9 Wilkinson  Lane, Telopea",2.0,3.0,1,<b></b><br />Explore the outstanding potential offered by this unique and exceptional property and capitalise on the tightly held and highly sought after settings of Telopea. The current home comprises 3 oversized bedrooms with 2 bathrooms and internal...,"['AirConditioning', 'BuiltInWardrobes', 'Floorboards', 'SecureParking']","Free standing house in a complex of 14, Carlingford West School catchment",2017092988.0,-33.78997,151.03891,https://bucket-api.domain.com.au/v1/bucket/image/2017092988_1_1_210624_030839-w2048-h1354,2117,Auction 17th July at 1.15pm (Unless Sold Prior),Wilkinson  Lane,TELOPEA,House,https://www.domain.com.au/1-9-wilkinson--lane--telopea-2117-2017092988,https://www.domain.com.au/1-9-wilkinson-lane-telopea-nsw-2117-2017092988,2021-07-10,,
"A611/28 Cowper Street, Granville",2.0,2.0,1,"<b></b><br />A selection of residence offers a convenient lifestyle at Granville Place apartment. It is a boutique development of an oversized 2-bed apartment located right next to Granville Station.

This 2 bedroom developed by Shokai and Tier 1 bui...","['AirConditioning', 'BuiltInWardrobes', 'Floorboards', 'Gas', 'InternalLaundry', 'SecureParking', 'GroundFloor', 'Gym', 'AlarmSystem', 'Intercom', 'BroadbandInternetAccess', 'Dishwasher', 'Study', 'BalconyDeck']",Brand New 2 Bedrooms + Huge Study Apartment,2017092613.0,-33.8324623,151.013611,https://bucket-api.domain.com.au/v1/bucket/image/2017092613_1_1_210624_020358-w5120-h3840,2142,Contact Agent,Cowper Street,GRANVILLE,ApartmentUnitFlat,https://www.domain.com.au/a611-28-cowper-street--granville-2142-2017092613,https://www.domain.com.au/a611-28-cowper-street-granville-nsw-2142-2017092613,2021-07-10,,
"17A Elsinore Street, Merrylands",3.0,3.0,2,"<b></b><br />Positioned in one of Merrylands most prestigious streets, is this large and modern 3-4 bedroom brick veneer strata title duplex in perfect condition. Suitable for first home buyers looking for a start in the market, retiree's wanting somet...","['AirConditioning', 'BuiltInWardrobes', 'InternalLaundry', 'SecureParking', 'SeparateDiningRoom', 'Dishwasher', 'Study', 'Shed']",Low maintenance Living at its Best!!!!,2017089031.0,-33.8416519,150.986877,https://bucket-api.domain.com.au/v1/bucket/image/2017089031_1_1_210623_122521-w1024-h674,2160,"Price Guide: $830,000 - $850,000",Elsinore Street,MERRYLANDS,House,https://www.domain.com.au/17a-elsinore-street--merrylands-2160-2017089031,https://www.domain.com.au/17a-elsinore-street-merrylands-nsw-2160-2017089031,2021-07-10,830000.0,850000.0
"14/5 Fig Tree Ave, Telopea",2.0,3.0,1,"<b></b><br />Immaculately presented throughout, this light & breezy 3 bedroom apartment is a short walk to Telopea's popular amenities. The inclusion of a large, covered balcony is ideal for entertainers & further enhances the indoor/outdoor vibe.

K...","['AirConditioning', 'BuiltInWardrobes', 'Ensuite', 'Gas', 'InternalLaundry', 'Intercom']",A Terrific Find in Telopea!,2017088741.0,-33.7937355,151.0442,https://bucket-api.domain.com.au/v1/bucket/image/2017088741_1_1_210622_111250-w2400-h1599,2117,"$673,000 - $683,000",Fig Tree Ave,TELOPEA,ApartmentUnitFlat,https://www.domain.com.au/14-5-fig-tree-ave--telopea-2117-2017088741,https://www.domain.com.au/14-5-fig-tree-ave-telopea-nsw-2117-2017088741,2021-07-10,673000.0,683000.0
"5/27-29 Brabyn Street, North Parramatta",2.0,3.0,2,"<b></b><br />Inspections by appointment only. Please contact our friendly sales team to book a suitable time. Strictly 1 person at a time and please wear your mask.

Peacefully positioned in one of Parramatta East's highly sought-after leafy streets,...","['BuiltInWardrobes', 'Ensuite', 'Floorboards', 'InternalLaundry', 'SecureParking', 'Bath', 'Dishwasher', 'BalconyDeck']","SUNNY, ROOMY & VALUE FOR MONEY",2017088502.0,-33.8057976,151.016556,https://bucket-api.domain.com.au/v1/bucket/image/2017088502_1_1_210622_095311-w1500-h999,2151,JUST LISTED,Brabyn Street,NORTH PARRAMATTA,Townhouse,https://www.domain.com.au/5-27-29-brabyn-street--north-parramatta-2151-2017088502,https://www.domain.com.au/5-27-29-brabyn-street-north-parramatta-nsw-2151-2017088502,2021-07-10,,
"8/8 Carinya Road, Girraween",2.0,3.0,1,"<b></b><br />**DAILY PRIVATE INSPECTIONS AVAILABLE**

Near New 3 Bedroom Villa. Two mins walk to Girraween Public School. Low Strata.
This immaculately presented, exceptional 157sqm three-bedroom villa offers a functional layout for a growing family an...","['AirConditioning', 'BuiltInWardrobes', 'Ensuite', 'Gas', 'InternalLaundry', 'PetsAllowed', 'AlarmSystem', 'Intercom', 'Heating', 'Dishwasher']",Near New 3 Bedroom Villa. Walk to Girraween Public School. Low Strata,2017088263.0,-33.7973862,150.949478,https://bucket-api.domain.com.au/v1/bucket/image/2017088263_1_1_210622_072639-w6000-h4000,2145,Contact Agent,Carinya Road,GIRRAWEEN,Villa,https://www.domain.com.au/8-8-carinya-road--girraween-2145-2017088263,https://www.domain.com.au/8-8-carinya-road-girraween-nsw-2145-2017088263,2021-07-10,,
"3/3 Chelmsford Road, South Wentworthville",2.0,3.0,2,"<b></b><br />Generously proportioned, immaculately maintained and ready to move straight into and enjoy, this modern townhouse offers comfort, space and exceptional convenience. It's walking distance to Wentworthville shops and T-way buses, with Parram...","['AirConditioning', 'BuiltInWardrobes', 'Ensuite', 'InternalLaundry', 'SecureParking', 'Study']","CALL TO BOOK PRIVATE INSPECTION

Relaxed family living in quality modern townhouse",2017088208.0,-33.817955,150.966248,https://bucket-api.domain.com.au/v1/bucket/image/2017088208_1_1_210622_071512-w5799-h3866,2145,Auction,Chelmsford Road,SOUTH WENTWORTHVILLE,Townhouse,https://www.domain.com.au/3-3-chelmsford-road--south-wentworthville-2145-2017088208,https://www.domain.com.au/3-3-chelmsford-road-south-wentworthville-nsw-2145-2017088208,2021-07-10,,
"2/49a Clarence Street, Merrylands",2.0,4.0,1,"<b></b><br />(Inspection by private appointment only) 

Located in the heart of convenience, this well-maintained and quality Torrens-titled duplex is near to all the amenities the Merrylands area has to offer. Positioned under 1km to nearby parks, the...","['AirConditioning', 'BuiltInWardrobes', 'Ensuite', 'Gas', 'InternalLaundry', 'SecureParking', 'Dishwasher']",Torrens-Titled Duplex in Ultra Convenient Location,2017087705.0,-33.8297462,150.9835,https://bucket-api.domain.com.au/v1/bucket/image/2017087705_1_1_210622_055815-w2100-h1397,2160,"Price Guide: $830,000 - $880,000",Clarence Street,MERRYLANDS,Duplex,https://www.domain.com.au/2-49a-clarence-street--merrylands-2160-2017087705,https://www.domain.com.au/2-49a-clarence-street-merrylands-nsw-2160-2017087705,2021-07-10,830000.0,880000.0
"87 Excelsior Street, Merrylands",2.0,3.0,3,"<b></b><br />Private Inspections Only 

Immaculate three bedroom family home boasts an elevated position on the high side of the street and commands an entire street corner. Positioned in one of Merrylands' most popular locations, this gorgeous propert...","['AirConditioning', 'Floorboards', 'Gas', 'SecureParking']",Stunning Home On An Elevated Corner Block,2017087381.0,-33.8457527,151.002457,https://bucket-api.domain.com.au/v1/bucket/image/2017087381_1_1_210622_050905-w1800-h1200,2160,Auction,Excelsior Street,MERRYLANDS,House,https://www.domain.com.au/87-excelsior-street--merrylands-2160-2017087381,https://www.domain.com.au/87-excelsior-street-merrylands-nsw-2160-2017087381,2021-07-10,,
