add,bath,bed,car,desc,features,headline,id,lat,lon,photo,postcode,price,street,suburb,type,url,url2,date,min_price,max_price
"85 Chelmsford Road, South Wentworthville",2.0,3.0,1,"<b></b><br />Enjoying a wonderful high-set position in a developing street filled with quality residences, this delightful three bedroom duplex home presents ideally for the growing family or first home buyer.  Presenting a generous living area with se...","['AirConditioning', 'BuiltInWardrobes', 'Ensuite', 'Gas', 'InternalLaundry', 'SecureParking', 'Shed']",SUPREMELY POSITIONED DUPLEX,2017085857.0,-33.8249626,150.96637,https://bucket-api.domain.com.au/v1/bucket/image/2017085857_1_1_210622_124318-w750-h499,2145,"Price Guide $790,000 - $840,000",Chelmsford Road,SOUTH WENTWORTHVILLE,House,https://www.domain.com.au/85-chelmsford-road--south-wentworthville-2145-2017085857,https://www.domain.com.au/85-chelmsford-road-south-wentworthville-nsw-2145-2017085857,2021-07-10,790000.0,840000.0
"4/64-66 Moffatts Drive, Dundas Valley",2.0,3.0,2,"<b></b><br />Viewings via private inspection only
Call 9630 7754 to book a private inspection

Peacefully positioned at the rear of a boutique complex of six, this full brick townhouse enjoys a leafy outlook and low maintenance lifestyle. Bright bre...","['AirConditioning', 'BuiltInWardrobes', 'Ensuite', 'Floorboards', 'Gas', 'InternalLaundry', 'SecureParking', 'BroadbandInternetAccess', 'Bath', 'Dishwasher']",Oversized Townhouse in Convenient Location,2017084916.0,-33.7935829,151.051453,https://bucket-api.domain.com.au/v1/bucket/image/2017084916_1_1_210621_070136-w1600-h1067,2117,Forthcoming Auction,Moffatts Drive,DUNDAS VALLEY,Townhouse,https://www.domain.com.au/4-64-66-moffatts-drive--dundas-valley-2117-2017084916,https://www.domain.com.au/4-64-66-moffatts-drive-dundas-valley-nsw-2117-2017084916,2021-07-10,,
Pemulwuy,2.0,4.0,2,"<b></b><br />Excellent opportunity to purchase a three to five bedroom OFF THE PLAN luxury residences in the most elevated part of Western Sydney, surrounded by parklands and recreation. These properties are being built by an award winning builder with...","['AirConditioning', 'BuiltInWardrobes', 'Ensuite', 'PetsAllowed', 'AlarmSystem', 'Intercom', 'Heating']",OFF THE PLAN - Standalone homes in Pemulwuy,2017081588.0,-33.817,150.926,https://bucket-api.domain.com.au/v1/bucket/image/2017081588_1_1_210618_064415-w1600-h1067,2145,Expressions of Interest,,PEMULWUY,House,https://www.domain.com.au/pemulwuy-2145-2017081588,https://www.domain.com.au/pemulwuy-nsw-2145-2017081588,2021-07-10,,
"414/46-50 Dunmore Street, Wentworthville",2.0,3.0,2,"<b></b><br />Apartment living in great location, this modern three bedroom, two bathroom apartment offers plenty of built in storage with large mirrored built in wardrobes. Enjoy open plan living overlooking the balcony. Great sized kitchen with stainl...","['AirConditioning', 'BuiltInWardrobes', 'Floorboards', 'Gas', 'SecureParking', 'AlarmSystem', 'Dishwasher', 'FullyFenced']",Call for Private Inspection,2017080832.0,-33.807785,150.970459,https://bucket-api.domain.com.au/v1/bucket/image/2017080832_1_1_210618_043328-w3000-h2002,2145,"Price Guide $749,950",Dunmore Street,WENTWORTHVILLE,ApartmentUnitFlat,https://www.domain.com.au/414-46-50-dunmore-street--wentworthville-2145-2017080832,https://www.domain.com.au/414-46-50-dunmore-street-wentworthville-nsw-2145-2017080832,2021-07-10,749950.0,749950.0
"64 Clyde Street, Granville",2.0,3.0,1,"<b></b><br />Positioned on a family friendly locale within walking distance to stations, schools, Woolworths and parks, this immaculately presented and well maintained brick home offers you an easy-care lifestyle with all conveniences

Main Features:

...","['BuiltInWardrobes', 'Floorboards', 'Gas', 'SecureParking']",Contemporary Single Level Brick House | Easy Walk to Stations,2017074708.0,-33.83944,151.013962,https://bucket-api.domain.com.au/v1/bucket/image/2017074708_1_1_210616_053716-w2048-h1365,2142,Auction,Clyde Street,GRANVILLE,House,https://www.domain.com.au/64-clyde-street--granville-2142-2017074708,https://www.domain.com.au/64-clyde-street-granville-nsw-2142-2017074708,2021-07-10,,
"190 Clyde Street, Granville",2.0,3.0,1,"<b></b><br />Here is your rare chance to obtain a piece of land in Sydney!

This land is set in a prime position with schools, trains, restaurants, and parklands all within a two kilometre radius.

Plenty of opportunity also exists with the land co...",[],TERRIFIC POTENTIAL!!!!!!!,2017074532.0,-33.8486938,151.012039,https://bucket-api.domain.com.au/v1/bucket/image/2017074532_1_1_210616_052306-w3462-h2609,2142,Contact Agent,Clyde Street,GRANVILLE,House,https://www.domain.com.au/190-clyde-street--granville-2142-2017074532,https://www.domain.com.au/190-clyde-street-granville-nsw-2142-2017074532,2021-07-10,,
"128 Greystanes Road, Greystanes",2.0,4.0,2,"<b></b><br />ATTENTION: Private Inspections (Sat 12.00-12.30pm) available during the times specified, please be patient with our agents as they accommodate each inspection following Covid-19 health and safety procedures. We thank you for your cooperati...","['AirConditioning', 'Floorboards', 'SecureParking', 'Furnished']",A GREYSTANES GEM,2017074500.0,-33.8203163,150.93364,https://bucket-api.domain.com.au/v1/bucket/image/2017074500_1_1_210616_051310-w1600-h1200,2145,Auction,Greystanes Road,GREYSTANES,House,https://www.domain.com.au/128-greystanes-road--greystanes-2145-2017074500,https://www.domain.com.au/128-greystanes-road-greystanes-nsw-2145-2017074500,2021-07-10,,
"56 Bertha Street, Merrylands",2.0,3.0,2,"<b></b><br />This property is a definite catch! You can move straight in!! Making this property the perfect first home, investment or family home. Make your move on this renovated 3 bedroom clad home in a whisper quiet location. Located in one of Merry...","['AirConditioning', 'BuiltInWardrobes', 'Floorboards', 'Gas', 'InternalLaundry', 'SecureParking', 'Dishwasher', 'Study']",Once in a lifetime sale!!!!!,2017073724.0,-33.8445244,150.9929,https://bucket-api.domain.com.au/v1/bucket/image/2017073724_1_1_210616_024055-w1024-h679,2160,ONLINE AUCTION 10/07/21 | CALL TO REGISTER TODAY,Bertha Street,MERRYLANDS,House,https://www.domain.com.au/56-bertha-street--merrylands-2160-2017073724,https://www.domain.com.au/56-bertha-street-merrylands-nsw-2160-2017073724,2021-07-10,100721.0,100721.0
"50/47 Wentwroth Ave, Westmead",2.0,3.0,1,"<b></b><br />A stylish family townhouse well positioned to the quiet rear of a gated complex presents a fantastic opportunity to own in one of the most sought-after suburbs.
This beautifully presented three bedrooms full brick townhouse is positioned ...","['AirConditioning', 'BuiltInWardrobes', 'Ensuite', 'InternalLaundry', 'SecureParking', 'BroadbandInternetAccess', 'Bath', 'Dishwasher', 'GardenCourtyard', 'BalconyDeck']",Stylish 3 bed family townhouse for sale,2017073482.0,-33.8074226,150.975983,https://bucket-api.domain.com.au/v1/bucket/image/2017073482_1_1_210616_020855-w2000-h1335,2145,Contact Agent,Wentwroth Ave,WESTMEAD,Townhouse,https://www.domain.com.au/50-47-wentwroth-ave--westmead-2145-2017073482,https://www.domain.com.au/50-47-wentwroth-ave-westmead-nsw-2145-2017073482,2021-07-10,,
"66B Braeside Road, Greystanes",3.0,4.0,1,"<b></b><br />Delivering exceptional style and quality, this outstanding duplex home presents the perfect opportunity to live a wonderful lifestyle enjoying both indoor and outdoor living spaces.
 
Positioned in a near perfect location & architecturally...","['AirConditioning', 'BuiltInWardrobes', 'SecureParking', 'Furnished', 'GroundFloor']",Stylish Modern Duplex - Executive Excellence,2017073441.0,-33.82344,150.954773,https://bucket-api.domain.com.au/v1/bucket/image/2017073441_1_1_210616_014803-w800-h534,2145,Expressions Of Interest,Braeside Road,GREYSTANES,House,https://www.domain.com.au/66b-braeside-road--greystanes-2145-2017073441,https://www.domain.com.au/66b-braeside-road-greystanes-nsw-2145-2017073441,2021-07-10,,
"6/64-66 Albert Street, North Parramatta",2.0,3.0,1,"<b></b><br />Inspections by appointment only. Please contact our friendly sales team to book a suitable time. Strictly 1 person at a time and please wear your mask.

This recently renovated spacious three bedroom apartment is perfectly positioned on ...","['AirConditioning', 'BuiltInWardrobes', 'Ensuite', 'Gas', 'InternalLaundry', 'SecureParking', 'AlarmSystem', 'Intercom', 'SeparateDiningRoom', 'Dishwasher', 'BalconyDeck']","FULLY RENOVATED, YOUR SEARCH IS OVER",2017072576.0,-33.80377,151.009674,https://bucket-api.domain.com.au/v1/bucket/image/2017072576_1_1_210615_010022-w1500-h1000,2151,AUCTION,Albert Street,NORTH PARRAMATTA,ApartmentUnitFlat,https://www.domain.com.au/6-64-66-albert-street--north-parramatta-2151-2017072576,https://www.domain.com.au/6-64-66-albert-street-north-parramatta-nsw-2151-2017072576,2021-07-10,,
"281/23-25 North Rocks Road, North Rocks",2.0,3.0,2,"<b></b><br />Located at the junction of North Rocks Road, James Ruse Drive (Cumberland Highway) and Windsor Road, this three bedroom north east facing apartment is perfect for the home owner or investor.


You'll be impressed with the size of this apar...","['AirConditioning', 'Ensuite', 'Gas', 'InternalLaundry', 'SwimmingPool', 'Intercom', 'Dishwasher', 'Study']",Totally 197sqm  Huge 3 bedroom in a Fantastic Location!,2017072304.0,-33.7905426,150.999451,https://bucket-api.domain.com.au/v1/bucket/image/2014623733_8_1_181123_071750-w960-h640,2151,"Under Contract, Richard 0420311662",281/23-25 North Rocks Road,NORTH ROCKS,ApartmentUnitFlat,https://www.domain.com.au/281-23-25-north-rocks-road--north-rocks-2151-2017072304,https://www.domain.com.au/281-23-25-north-rocks-road-north-rocks-nsw-2151-2017072304,2021-07-10,,
"481c Great Western Highway, Greystanes",2.0,3.0,1,"<b></b><br />Completed in made-to-last full-brick construction with lovely easy-care tiled flooring across the ample living spaces, there is much to like about this generous family home. Offering a fresh air-conditioned living area, separate sunken din...","['AirConditioning', 'BuiltInWardrobes', 'Ensuite', 'Gas', 'SecureParking', 'Heating', 'Shed']","THREE BEDROOM, FULL BRICK",2017072152.0,-33.8126259,150.954819,https://bucket-api.domain.com.au/v1/bucket/image/2017072152_1_1_210615_072557-w750-h499,2145,"Price Guide $750,000 - $800,000",Great Western Highway,GREYSTANES,House,https://www.domain.com.au/481c-great-western-highway--greystanes-2145-2017072152,https://www.domain.com.au/481c-great-western-highway-greystanes-nsw-2145-2017072152,2021-07-10,750000.0,800000.0
"1/149B Bettington Road, Oatlands",2.0,3.0,2,"<b></b><br />Though the environment has changed, delivering great results remains the same!  Call or email today to arrange a private 1:1 viewing. We request you wear a mask and maintain 1.5 metre social distancing. Hand sanitizer will be available.
...","['AirConditioning', 'Ensuite', 'Floorboards', 'Gas', 'SecureParking', 'Study']",Plus-Sized Townhouse!,2017071031.0,-33.788166,151.028183,https://bucket-api.domain.com.au/v1/bucket/image/2017071031_1_1_210615_042358-w2400-h1667,2117,Online Auction,Bettington Road,OATLANDS,Townhouse,https://www.domain.com.au/1-149b-bettington-road--oatlands-2117-2017071031,https://www.domain.com.au/1-149b-bettington-road-oatlands-nsw-2117-2017071031,2021-07-10,,
"38 Roberta Street, Greystanes",3.0,4.0,1,"<b></b><br />Offering two self-contained residences on one flat 558.4sqm property, here is a fabulous opportunity that will suit a number of buyers from investors seeking dual rental income to the larger or extended family needing separate homes. The m...","['AirConditioning', 'BuiltInWardrobes', 'Ensuite', 'Study', 'Shed']","DUAL LIVING, DUAL INCOME",2017070569.0,-33.8199158,150.941055,https://bucket-api.domain.com.au/v1/bucket/image/2017070569_1_1_210615_030131-w750-h499,2145,"Price Guide $950,000 - $1,045,000",Roberta Street,GREYSTANES,House,https://www.domain.com.au/38-roberta-street--greystanes-2145-2017070569,https://www.domain.com.au/38-roberta-street-greystanes-nsw-2145-2017070569,2021-07-10,950000.0,1045000.0
"59A Alto Street, South Wentworthville",2.0,4.0,2,"<b></b><br />'Based on the instructions from the NSW Government, all open homes and in-person auctions have been cancelled until the completion of the stay-at-home order. We are however still able to conduct private appointment viewings of properties.'...","['Ensuite', 'Gas', 'InternalLaundry', 'SecureParking', 'AlarmSystem', 'Intercom', 'Heating', 'Dishwasher', 'FullyFenced']",AUCTION CANCELLED,2017069731.0,-33.8216476,150.974747,https://bucket-api.domain.com.au/v1/bucket/image/2017069731_1_1_210614_111656-w1600-h1068,2145,AUCTION,Alto Street,SOUTH WENTWORTHVILLE,House,https://www.domain.com.au/59a-alto-street--south-wentworthville-2145-2017069731,https://www.domain.com.au/59a-alto-street-south-wentworthville-nsw-2145-2017069731,2021-07-10,,
"13 Morris  Street, Merrylands",2.0,4.0,2,"<b></b><br />LIVESTREAM AUCTION - 10/07/2021 at 1pm

Perfectly poised on a 428.4 square metre (approx) corner block with a wide 15.8m frontage(approx) is this four (4) bedroom family home in a premier location. Finally, here is your opportunity to secu...","['AirConditioning', 'Ensuite', 'InternalLaundry', 'SecureParking', 'Study', 'FullyFenced']","Move in, Develop or Invest in Blue Ribbon Location",2017068176.0,-33.84026,150.97995,https://bucket-api.domain.com.au/v1/bucket/image/2017068176_1_1_210612_102210-w1920-h1280,2160,LIVESTREAM AUCTION - Saturday 10th July at 1pm,Morris  Street,MERRYLANDS,House,https://www.domain.com.au/13-morris--street--merrylands-2160-2017068176,https://www.domain.com.au/13-morris-street-merrylands-nsw-2160-2017068176,2021-07-10,,
"8/10-12 Bowden Street, North Parramatta",2.0,3.0,2,"<b></b><br />Luxuriously spread over four spacious levels, this townhouse boasts large proportions and high ceilings. Upon entry, you are greeted with an open and spacious family area, comprising of the dining and kitchen area, which flows seamlessly t...","['AirConditioning', 'BuiltInWardrobes', 'Ensuite', 'InternalLaundry', 'SecureParking']",Inspection by appointment,2017065652.0,-33.80485,151.019745,https://bucket-api.domain.com.au/v1/bucket/image/2017065652_1_1_210611_121857-w1500-h1000,2151,"For Sale | $880,000 - $920,000",Bowden Street,NORTH PARRAMATTA,Townhouse,https://www.domain.com.au/8-10-12-bowden-street--north-parramatta-2151-2017065652,https://www.domain.com.au/8-10-12-bowden-street-north-parramatta-nsw-2151-2017065652,2021-07-10,880000.0,920000.0
"1/33 Burke Street, Telopea",2.0,3.0,2,"<b></b><br />THIS IS THE ONE!! TOTAL AREA 257sqm
Peacefully positioned this near new townhouse offers your family easy access to all the amenities.
Saturated with heaps of natural light and greenery, this superbly bright and airy townhouse is immaculat...","['AirConditioning', 'BuiltInWardrobes', 'Ensuite', 'SecureParking', 'Furnished', 'Dishwasher', 'BalconyDeck']",UNDER CONTRACT BY TOM CHAN,2017063072.0,-33.79739,151.040833,https://bucket-api.domain.com.au/v1/bucket/image/2017063072_1_1_210610_124141-w1200-h800,2117,UNDER CONTRACT BY TOM CHAN,Burke Street,TELOPEA,Townhouse,https://www.domain.com.au/1-33-burke-street--telopea-2117-2017063072,https://www.domain.com.au/1-33-burke-street-telopea-nsw-2117-2017063072,2021-07-10,,
Pendle Hill,3.0,3.0,1,"<b></b><br />A magnificent opportunity now exists to secure a slice of the ever popular Pendle Hill property market. This superb duplex, beaming in elegance and sophistication and exuding a wealth of living options will be everything a larger family de...","['AirConditioning', 'BuiltInWardrobes', 'Ensuite', 'Floorboards', 'Gas', 'InternalLaundry', 'SecureParking', 'Study']",GIRRAWEEN PUBLIC CATCHMENT!!!!!!,2017061881.0,-33.80739,150.955185,https://bucket-api.domain.com.au/v1/bucket/image/2017061881_1_1_210609_072352-w3502-h2501,2145,Contact Agent,,PENDLE HILL,Duplex,https://www.domain.com.au/pendle-hill-2145-2017061881,https://www.domain.com.au/pendle-hill-nsw-2145-2017061881,2021-07-10,,
"Level 8/38 Cowper Street, Granville",2.0,2.0,1,"<b></b><br />Beautiful architecture rises above a dynamic new family-friendly neighbourhood; a whole new urban village a stone's throw away from Parramatta, Sydney's second CBD

Live directly above the newly opened Woolworths Metro and pedestrian lin...","['AirConditioning', 'BuiltInWardrobes', 'Ensuite', 'Gas', 'InternalLaundry', 'SecureParking', 'Intercom', 'BroadbandInternetAccess', 'Bath', 'Dishwasher', 'Study']",Premium 2 bed Plus Study  Apartments At An Affordable Price!,2017060635.0,-33.83208,151.012817,https://bucket-api.domain.com.au/v1/bucket/image/2017060635_1_1_210609_035250-w1600-h1066,2142,For Sale,Cowper Street,GRANVILLE,ApartmentUnitFlat,https://www.domain.com.au/level-8-38-cowper-street--granville-2142-2017060635,https://www.domain.com.au/level-8-38-cowper-street-granville-nsw-2142-2017060635,2021-07-10,,
"14/26-30 Elizabeth Street, Granville",2.0,3.0,1,"<b></b><br />Presenting this peacefully positioned bright and split level town house is located in the heart of Granville . This amazing house presents three generous sized bed rooms with built-in-all, specious open plan living and dining with modern s...","['BuiltInWardrobes', 'Ensuite', 'SecureParking']",Beautiful Townhouse for sales,2017056316.0,-33.8384361,151.007874,https://bucket-api.domain.com.au/v1/bucket/image/2017056316_1_1_210608_012853-w2000-h1333,2142,$710000-$740000,Elizabeth Street,GRANVILLE,Townhouse,https://www.domain.com.au/14-26-30-elizabeth-street--granville-2142-2017056316,https://www.domain.com.au/14-26-30-elizabeth-street-granville-nsw-2142-2017056316,2021-07-10,,
"14a Richardson Street, Merrylands",2.0,4.0,2,"<b></b><br />Privately located in a quiet battle-axe position, this sunny four bedroom family home guarantees a quiet lifestyle with loads of living space. Featuring delightful easy-care tiled flooring throughout, the fresh and bright residence include...","['AirConditioning', 'BuiltInWardrobes', 'Gas', 'SecureParking', 'Shed']",PRIVATE LIVING,2017055433.0,-33.8278427,150.978,https://bucket-api.domain.com.au/v1/bucket/image/2017055433_1_1_210607_072425-w750-h500,2160,"$839,950",Richardson Street,MERRYLANDS,House,https://www.domain.com.au/14a-richardson-street--merrylands-2160-2017055433,https://www.domain.com.au/14a-richardson-street-merrylands-nsw-2160-2017055433,2021-07-10,839950.0,839950.0
"14b Roberta Street, Greystanes",4.0,4.0,1,"<b></b><br />Set on an ample 282.8sqm north-facing block with a large and private manicured lawn, here is a premium quality, near new sun-filled residence which is ideal for those seeking a fresh and modern lifestyle.  Boasting multi-zone ducted air-co...","['AirConditioning', 'BuiltInWardrobes', 'Ensuite', 'Gas', 'SecureParking', 'SeparateDiningRoom']",NORTH FACING DELIGHT,2017054607.0,-33.81974,150.939209,https://bucket-api.domain.com.au/v1/bucket/image/2017054607_1_1_210607_040216-w750-h500,2145,"$995,950",Roberta Street,GREYSTANES,House,https://www.domain.com.au/14b-roberta-street--greystanes-2145-2017054607,https://www.domain.com.au/14b-roberta-street-greystanes-nsw-2145-2017054607,2021-07-10,995950.0,995950.0
"2/8-9 Mildred Street, Wentworthville",2.0,3.0,2,"<b></b><br />A low maintenance sanctuary of contemporary design, this townhouse provides an effortless lifestyle for young families, entry level buyers or investors. Its cul-de-sac location is a short walk to Wentworthville Station, cafés, restaurants ...","['AirConditioning', 'BuiltInWardrobes', 'Ensuite', 'Gas', 'Bath', 'Heating', 'Study']","CALL TO BOOK PRIVATE INSPECTION

Contemporary townhouse offers an easycare lifestyle",2017054128.0,-33.81085,150.967712,https://bucket-api.domain.com.au/v1/bucket/image/2017054128_1_1_210607_014047-w1600-h1200,2145,"$770,000 to $795,000",Mildred Street,WENTWORTHVILLE,Townhouse,https://www.domain.com.au/2-8-9-mildred-street--wentworthville-2145-2017054128,https://www.domain.com.au/2-8-9-mildred-street-wentworthville-nsw-2145-2017054128,2021-07-10,770000.0,795000.0
"3/25-27 Dixmude Street, Granville",2.0,3.0,2,"<b></b><br />TO INSPECT A PROPERTY
 
During the Covid19 lockdown period, you are still able to view a property but it is By Appointment only, and only one person at a time is allowed to be inside the property with the agent. To book an appointment, ple...","['BuiltInWardrobes', 'Gas', 'InternalLaundry', 'SecureParking', 'GroundFloor']",TERRIFIC TOWNHOUSE!,2017049480.0,-33.8550758,151.01358,https://bucket-api.domain.com.au/v1/bucket/image/2017049480_1_1_210603_051605-w1198-h797,2142,"$690,000 to $740,000 - Price Guide",Dixmude Street,GRANVILLE,Townhouse,https://www.domain.com.au/3-25-27-dixmude-street--granville-2142-2017049480,https://www.domain.com.au/3-25-27-dixmude-street-granville-nsw-2142-2017049480,2021-07-10,690000.0,740000.0
"76 Betts Road, Merrylands",3.0,4.0,2,"<b></b><br />--------------------------------------------------------
For full address details, inspection times,
additional photos and floor plan,
click ""Email Agent"" and quote: ID #8389
--------------------------------------------------------
 
 Read...","['AirConditioning', 'BuiltInWardrobes', 'Floorboards', 'Gas', 'InternalLaundry', 'SecureParking', 'SwimmingPool', 'Dishwasher']",Swiss Style in the West,2017048346.0,-33.8351021,150.959137,https://bucket-api.domain.com.au/v1/bucket/image/2017048346_15_1_210603_011213-w1300-h867,2160,Auction: POSTPONED DUE TO COVID-19 RESTRICTIONS,Betts Road,MERRYLANDS,House,https://www.domain.com.au/76-betts-road--merrylands-2160-2017048346,https://www.domain.com.au/76-betts-road-merrylands-nsw-2160-2017048346,2021-07-10,,
"10/514-524 Victoria Road, Rydalmere",2.0,3.0,1,"<b></b><br />Smartly presented, this appealing double brick townhouse with leafy outlook is spacious, bright and perfectly designed to provide a desirable indoor/outdoor lifestyle. The sought-after location is a short stroll to Ermington's shops, river...","['AirConditioning', 'BuiltInWardrobes', 'Ensuite', 'Gas', 'InternalLaundry', 'SecureParking', 'Heating', 'Shed']",Idyllic home in superb walk-to-everywhere locale,2017047517.0,-33.8134727,151.0519,https://bucket-api.domain.com.au/v1/bucket/image/2017047517_1_1_210602_085359-w2000-h1333,2116,"$850,000",Victoria Road,RYDALMERE,Townhouse,https://www.domain.com.au/10-514-524-victoria-road--rydalmere-2116-2017047517,https://www.domain.com.au/10-514-524-victoria-road-rydalmere-nsw-2116-2017047517,2021-07-10,850000.0,850000.0
"7/51-53 South Street, Rydalmere",2.0,2.0,1,"<b></b><br />Private Inspections Only 

Spacious two bedroom apartment with study in a modern security complex. This immaculately presented and well maintained light filled apartment boasts a practical floor plan with an oversized kitchen, gorgeous out...","['AirConditioning', 'Ensuite', 'Study']",Immaculately Presented Two Bedroom Apartment With Huge Study,2017044470.0,-33.8153038,151.043015,https://bucket-api.domain.com.au/v1/bucket/image/2017044470_1_1_210601_070635-w1800-h1200,2116,Contact Agent,South Street,RYDALMERE,ApartmentUnitFlat,https://www.domain.com.au/7-51-53-south-street--rydalmere-2116-2017044470,https://www.domain.com.au/7-51-53-south-street-rydalmere-nsw-2116-2017044470,2021-07-10,,
"2/64 Belmore Street, North Parramatta",3.0,3.0,2,"<b></b><br />Located just five minutes north of the Parramatta CBD is this tri-level townhouse offering three bedrooms, 3.5 bathrooms and an idyllic place to call home. The inviting layout is spacious and comfortable with room to host guests in style. ...","['AirConditioning', 'BuiltInWardrobes', 'Ensuite', 'Gas', 'SecureParking', 'Dishwasher']",Spacious 3-level townhouse in a prized locale,2017043740.0,-33.8004379,151.015274,https://bucket-api.domain.com.au/v1/bucket/image/2017043740_1_1_210601_044300-w2100-h1400,2151,Contact Agent,Belmore Street,NORTH PARRAMATTA,Townhouse,https://www.domain.com.au/2-64-belmore-street--north-parramatta-2151-2017043740,https://www.domain.com.au/2-64-belmore-street-north-parramatta-nsw-2151-2017043740,2021-07-10,,
"15/38 Boomerang St, Granville",2.0,3.0,2,"<b></b><br />Executive Penthouse Living

With an abundance of sunlit interior space, a huge wrap around entertainment terrace and a distant panoramic outlook, this executive style luxury penthouse apartment enjoys more features than you could imagine. ...","['BuiltInWardrobes', 'Ensuite', 'Gas', 'SecureParking', 'Furnished', 'CityViews', 'Intercom', 'Bath']","FOR SALE BY EXPRESSIONS OF INTEREST, OFFERS CLOSING MONDAY 21/06/2021 AT 5:00PM.",2017042069.0,-33.8331566,150.999039,https://bucket-api.domain.com.au/v1/bucket/image/2017042069_2_1_210531_054707-w1600-h1200,2142,Expressions of Interest,Boomerang St,GRANVILLE,ApartmentUnitFlat,https://www.domain.com.au/15-38-boomerang-st--granville-2142-2017042069,https://www.domain.com.au/15-38-boomerang-st-granville-nsw-2142-2017042069,2021-07-10,,
"93 Jersey Road, Greystanes",2.0,4.0,1,"<b></b><br />All the work has been done for you. Lovely property, freshly painted, new kitchen and four bedrooms with multiple living spaces. High ceilings and lock up garage. Private backyard all in a convenient location. Call today for further detail...",['SecureParking'],LOVELY FAMILY HOME!!!,2017041883.0,-33.8259048,150.962128,https://bucket-api.domain.com.au/v1/bucket/image/2017041883_1_1_210531_051017-w1600-h1066,2145,"PRICE GUIDE $825,000",Jersey Road,GREYSTANES,House,https://www.domain.com.au/93-jersey-road--greystanes-2145-2017041883,https://www.domain.com.au/93-jersey-road-greystanes-nsw-2145-2017041883,2021-07-10,825000.0,825000.0
