add,bath,bed,car,desc,features,headline,id,lat,lon,photo,postcode,price,street,suburb,type,url,url2,date,min_price,max_price
Parramatta,2.0,2.0,1.0,"<b></b><br />Property1Group is proud to present this elegantly designed with an abundance of natural light welcoming two bedroom apartments, in prime location.
The apartments have been designed both for people with a busy lifestyle and those wishing to...","['AirConditioning', 'BuiltInWardrobes', 'Gas', 'SecureParking', 'AlarmSystem', 'Intercom', 'Dishwasher']","--2 Mins walk to Parramatta Station
--Ready to move in 2 months",2017126367.0,-33.8135567,151.0034,https://bucket-api.domain.com.au/v1/bucket/image/2017126367_1_1_210710_060227-w565-h637,2150,Contact Agent,,PARRAMATTA,NewApartments,https://www.domain.com.au/parramatta-2150-2017126367,https://www.domain.com.au/parramatta-nsw-2150-2017126367,2021-07-10,,
"1604A/8 Cowper Street, Parramatta",2.0,2.0,2.0,"<b></b><br />Inspections by appointment only. Please contact our friendly sales team to book a suitable time. Strictly 1 person at a time and please wear your mask.

Situated on levels 16 & 17 of the landmark building 'Gallery By Crown', this sophist...","['AirConditioning', 'BuiltInWardrobes', 'Ensuite', 'Gas', 'InternalLaundry', 'SecureParking', 'SwimmingPool', 'Study']",LUXURIOUS 187m2 DUAL-LEVEL PENTHOUSE IN PARRAMATTA CBD,2017123205.0,-33.821228,151.007019,https://bucket-api.domain.com.au/v1/bucket/image/2017123205_1_1_210708_081737-w1920-h1280,2150,JUST LISTED,Cowper Street,PARRAMATTA,ApartmentUnitFlat,https://www.domain.com.au/1604a-8-cowper-street--parramatta-2150-2017123205,https://www.domain.com.au/1604a-8-cowper-street-parramatta-nsw-2150-2017123205,2021-07-10,,
"260/109-111 George Street, Parramatta",2.0,2.0,1.0,"<b></b><br />Contemporary living at Koi Parramatta. Perfectly positioned on Level 17 this gorgeous two bedroom dual key apartment offers luxurious cosmopolitan living in the heart of the thriving Parramatta CBD. Boasting two spacious bedrooms, dual bal...","['AirConditioning', 'Intercom']",Dual Key Apartment In The Heart Of The Parramatta CBD,2017122247.0,-33.81562,151.010178,https://bucket-api.domain.com.au/v1/bucket/image/2017122247_1_1_210708_044936-w1800-h1200,2150,Just Listed,George Street,PARRAMATTA,ApartmentUnitFlat,https://www.domain.com.au/260-109-111-george-street--parramatta-2150-2017122247,https://www.domain.com.au/260-109-111-george-street-parramatta-nsw-2150-2017122247,2021-07-10,,
"1805/12-14 Phillip Street, Parramatta",2.0,2.0,1.0,"<b></b><br />Brand new 2 bedroom luxurious apartment situated in the heart of Parramatta. Offering a lifestyle of convenience, 'The Lennox' residences are within close proximity to world class dining precincts, transport hubs, shopping centre and the b...","['Floorboards', 'Gas', 'SwimmingPool', 'Gym', 'Intercom']",Luxurious Riverside Apartment,2017112687.0,-33.81135,151.00351,https://bucket-api.domain.com.au/v1/bucket/image/2017112687_1_1_210705_015131-w1512-h704,2150,Contact Agent,Phillip Street,PARRAMATTA,ApartmentUnitFlat,https://www.domain.com.au/1805-12-14-phillip-street--parramatta-2150-2017112687,https://www.domain.com.au/1805-12-14-phillip-street-parramatta-nsw-2150-2017112687,2021-07-10,,
"100/109-113 George Street, Parramatta",2.0,2.0,1.0,"<b></b><br />Covid-19 Safety Plan:
We are following the guidelines from NSW Health Department.
-	We required to keep records of those attending in case contact and tracing is needed.
-	Those with symptoms of illness will not allowed to attend inspec...","['AirConditioning', 'BuiltInWardrobes', 'Ensuite', 'Gas', 'InternalLaundry', 'PetsAllowed', 'SecureParking', 'Furnished', 'Gym', 'Intercom', 'BroadbandInternetAccess', 'Bath', 'Dishwasher', 'BalconyDeck']",Spacious with district view apartment,2017115598.0,-33.8156128,151.010117,https://bucket-api.domain.com.au/v1/bucket/image/2017115598_1_1_210706_023507-w1336-h2000,2150,"$620,000 to $650,000 Motivated Vendor",George Street,PARRAMATTA,ApartmentUnitFlat,https://www.domain.com.au/100-109-113-george-street--parramatta-2150-2017115598,https://www.domain.com.au/100-109-113-george-street-parramatta-nsw-2150-2017115598,2021-07-10,620000.0,650000.0
Parramatta,2.0,2.0,,"<b></b><br />The 2nd CBD of Sydney now presents a landmark development. Come and stake your claim.  
Walking distance to Westfield Shopping Centre, Parramatta Park and Reputed Schools. 
Parramatta is getting benefitted with the Light Rail and this will...","['AirConditioning', 'BuiltInWardrobes', 'Gas', 'SwimmingPool', 'AlarmSystem', 'Intercom']",MODERN APARTMENT IN A SOUGHT-AFTER ICONIC DEVELOPMENT. CALL NOW TO INSPECT THE DISPLAY AND PICK YOUR CHOICE BEFORE INVENTORY RUNS OUT.,2017104324.0,-33.8135567,151.0034,https://bucket-api.domain.com.au/v1/bucket/image/2017104324_1_1_210630_040057-w900-h638,2150,"From $767,000 Onwards",,PARRAMATTA,NewApartments,https://www.domain.com.au/parramatta-2150-2017104324,https://www.domain.com.au/parramatta-nsw-2150-2017104324,2021-07-10,767000.0,767000.0
"4/12 Pemberton Street, Parramatta",2.0,4.0,2,"<b></b><br />Never to be built out & adjoining Baludarri Reserve, this solid dual level double brick 4 bedroom town home offers the ideal lifestyle location & in a sought after riverbank locale. Situated in a boutique complex of only 4 & within an easy...","['AirConditioning', 'Ensuite', 'Gas', 'InternalLaundry', 'SecureParking', 'Bath', 'Dishwasher']",Parkland position & double brick construction,2017100551.0,-33.81354,151.0199,https://bucket-api.domain.com.au/v1/bucket/image/2017100551_1_1_210628_113949-w1920-h1280,2150,Auction,Pemberton Street,PARRAMATTA,Townhouse,https://www.domain.com.au/4-12-pemberton-street--parramatta-2150-2017100551,https://www.domain.com.au/4-12-pemberton-street-parramatta-nsw-2150-2017100551,2021-07-10,,
"806/25-29 Cowper Street, Parramatta",2.0,3.0,2,"<b></b><br />This spacious 3 Beds 2baths apartment situated on level 8 of a modern security building ,this ultra sleek 3 bedroom apartment boasts stunning interiors with a smart floor plan and cross ventilation.Positioned in the heart of the parramatta...","['AirConditioning', 'BuiltInWardrobes', 'Ensuite', 'Gas', 'InternalLaundry', 'SecureParking', 'Intercom', 'Bath', 'Dishwasher']",UNDER OFFER,2017094714.0,-33.82058,151.006348,https://bucket-api.domain.com.au/v1/bucket/image/2017094714_1_1_210624_115029-w1200-h800,2150,$799000.00,Cowper Street,PARRAMATTA,ApartmentUnitFlat,https://www.domain.com.au/806-25-29-cowper-street--parramatta-2150-2017094714,https://www.domain.com.au/806-25-29-cowper-street-parramatta-nsw-2150-2017094714,2021-07-10,,
"B304/9 Hassall Street, Parramatta",2.0,3.0,1,"<b></b><br />The vibrant heart of Parramatta: a premium apartment in a superb location
In the heart of Parramatta, the Imperial is just minutes walk from the Parramatta Train Station, Westfield Shopping Centre, the $2.7 billion Parramatta Square devel...","['AirConditioning', 'BuiltInWardrobes', 'Ensuite', 'Gas', 'SecureParking', 'AlarmSystem', 'Intercom', 'BroadbandInternetAccess', 'Dishwasher', 'BalconyDeck']",Newly established! Amenities at every turn!,2017093264.0,-33.8182755,151.008041,https://bucket-api.domain.com.au/v1/bucket/image/2017093264_1_1_210624_041738-w1200-h800,2150,"$925,000",Hassall Street,PARRAMATTA,ApartmentUnitFlat,https://www.domain.com.au/b304-9-hassall-street--parramatta-2150-2017093264,https://www.domain.com.au/b304-9-hassall-street-parramatta-nsw-2150-2017093264,2021-07-10,925000.0,925000.0
"B301/9 Hassall st, Parramatta",2.0,2.0,1,"<b></b><br />In the heart of Parramatta, the Imperial is just minutes walk from the Parramatta Train Station, Westfield Shopping Centre, the $2.7 billion Parramatta Square development, and a plethora of essential facilities including schools, restauran...","['AirConditioning', 'BuiltInWardrobes', 'Ensuite', 'Gas', 'SecureParking', 'AlarmSystem', 'Intercom', 'Dishwasher', 'BalconyDeck']",Smart living in the heart of Parramatta,2017093042.0,-33.8182755,151.008041,https://bucket-api.domain.com.au/v1/bucket/image/2016436814_11_1_210111_021545-w1200-h800,2150,Contact agent,Hassall st,PARRAMATTA,ApartmentUnitFlat,https://www.domain.com.au/b301-9-hassall-st--parramatta-2150-2017093042,https://www.domain.com.au/b301-9-hassall-st-parramatta-nsw-2150-2017093042,2021-07-10,,
"401/11 Hassall Street, Parramatta",2.0,2.0,1,"<b></b><br />It is a landmark Residential tower in the heart of Parramatta. The Skyrise is the second tallest tower in the Parramatta CBD.
Situated less than 300 metres to all CBD amenities including Parramatta railway station, Parramatta Square, bus i...","['BuiltInWardrobes', 'Ensuite', 'Gas', 'InternalLaundry', 'NorthFacing', 'Intercom']",Premium north facing  2beds apartment in landmark Building in parramatta,2016297698.0,-33.81812,151.00827,https://bucket-api.domain.com.au/v1/bucket/image/2016297698_8_1_200605_013514-w1179-h630,2150,Contact Agent,Hassall Street,PARRAMATTA,ApartmentUnitFlat,https://www.domain.com.au/401-11-hassall-street--parramatta-2150-2016297698,https://www.domain.com.au/401-11-hassall-street-parramatta-nsw-2150-2016297698,2021-07-10,,
"18/346 Church Street, Parramatta",2.0,2.0,1,"<b></b><br />An exceptional opportunity to secure this 2 bedroom apartment situated in a highly sought-after security executive complex ""Museum Gardens"", positioned on the vibrant riverbank within a short stroll to Rivercat ferry, railway station, bus ...","['Ensuite', 'Gas', 'SwimmingPool', 'Gym', 'Dishwasher']",Stunning River Views,2017085670.0,-33.8104324,151.005249,https://bucket-api.domain.com.au/v1/bucket/image/2017085670_1_1_210621_113858-w4500-h3000,2150,Contact Agent,Church Street,PARRAMATTA,ApartmentUnitFlat,https://www.domain.com.au/18-346-church-street--parramatta-2150-2017085670,https://www.domain.com.au/18-346-church-street-parramatta-nsw-2150-2017085670,2021-07-10,,
"9 9 Hassall Street, Parramatta",2.0,2.0,1,"<b></b><br />It is a brand new apartment  which located in the heart of Parramatta CBD, this mordern apartment has two good size bedrooms and stunning views. Enjoying a wonderful lifestyle and  benefits of CBD location. It is an affordable living choic...",[],"brand new apartment  which located in the heart of Parramatta CBD,",2017080532.0,-33.8182755,151.008041,https://bucket-api.domain.com.au/v1/bucket/image/2017080532_1_1_210618_032601-w1080-h1440,2150,contact agent,9 Hassall Street,PARRAMATTA,ApartmentUnitFlat,https://www.domain.com.au/9-9-hassall-street--parramatta-2150-2017080532,https://www.domain.com.au/9-9-hassall-street-parramatta-nsw-2150-2017080532,2021-07-10,,
"5/74 Pemberton Street, Parramatta",2.0,3.0,1,"<b></b><br />Inspections by appointment only. Please contact our friendly sales team to book a suitable time. Strictly 1 person at a time and please wear your mask.

Spanning a generous 173m2 (approx) of living space, this modern dual level townhouse...","['AirConditioning', 'BuiltInWardrobes', 'Ensuite', 'Gas', 'InternalLaundry', 'SecureParking', 'Dishwasher']",DOUBLE BRICK TOWNHOUSE IN RIVERBANK LOCATION,2017076766.0,-33.80789,151.021149,https://bucket-api.domain.com.au/v1/bucket/image/2017076766_1_1_210617_013018-w1920-h1280,2150,Auction - Unless Sold Prior,Pemberton Street,PARRAMATTA,Townhouse,https://www.domain.com.au/5-74-pemberton-street--parramatta-2150-2017076766,https://www.domain.com.au/5-74-pemberton-street-parramatta-nsw-2150-2017076766,2021-07-10,,
Parramatta,2.0,2.0,1,"<b></b><br />WE HAVE MULTIPLE PROPERTIES AVAILABLE IN THE ABOVE PRICE RANGE.
CONTACT AGENT.

This brand new apartment in the center of Parramatta comprises premium inclusions along with state of the art finishings. With the new light rail station at yo...","['AirConditioning', 'BuiltInWardrobes', 'Ensuite', 'SwimmingPool', 'WaterViews', 'CityViews', 'Gym', 'AlarmSystem', 'Intercom', 'Heating']",Pinnacle of Luxury in the heart of Parramatta!,2017070506.0,-33.8135567,151.0034,https://bucket-api.domain.com.au/v1/bucket/image/2017070506_1_1_210615_025039-w5000-h2813,2150,"$785,000 - $995,000",,PARRAMATTA,ApartmentUnitFlat,https://www.domain.com.au/parramatta-2150-2017070506,https://www.domain.com.au/parramatta-nsw-2150-2017070506,2021-07-10,785000.0,995000.0
Parramatta,2.0,3.0,1,"<b></b><br />This spacious three bed room townhouse sits at 165 square meter unit and is easily adaptable to a 4 bedroom should you choose so. 

Situated amongst a quiet complex of 12 others and surrounded by parkland, you could hardly believe that you...","['AirConditioning', 'Floorboards', 'Gas', 'InternalLaundry', 'SecureParking']",Ready to move into,2017068061.0,-33.8135567,151.0034,https://bucket-api.domain.com.au/v1/bucket/image/2016880044_1_1_210406_091933-w1920-h1367,2150,$800k Commence Bidding,,PARRAMATTA,Townhouse,https://www.domain.com.au/parramatta-2150-2017068061,https://www.domain.com.au/parramatta-nsw-2150-2017068061,2021-07-10,,
"810/45 Macquarie Street, Parramatta",2.0,2.0,1,"<b></b><br />Embracing panoramic east facing views, this generous apartment is located on the 8th floor of the coveted 'V by Crown' complex. It offers luxurious resort style living in the heart of Parramatta, a stroll from Westfield, eateries and the t...","['AirConditioning', 'BuiltInWardrobes', 'Ensuite', 'Gas', 'PetsAllowed', 'SwimmingPool', 'Gym', 'Intercom', 'Bath']",Luxurious two bedroom apartment with panoramic views,2017056668.0,-33.81484,151.001251,https://bucket-api.domain.com.au/v1/bucket/image/2017056668_1_1_210608_025055-w1600-h1200,2150,"Price Guide $780,000",Macquarie Street,PARRAMATTA,ApartmentUnitFlat,https://www.domain.com.au/810-45-macquarie-street--parramatta-2150-2017056668,https://www.domain.com.au/810-45-macquarie-street-parramatta-nsw-2150-2017056668,2021-07-10,780000.0,780000.0
Parramatta,2.0,2.0,1,"<b></b><br />The 67 level glass tower is the tallest riverfront building ever to grace Parramatta's skies offering panoramic views from almost every apartment.
The Parramatta free shuttle bus service is located on your doorstep and the upgraded Parrama...","['AirConditioning', 'BuiltInWardrobes', 'CableOrSatellite', 'Ensuite', 'Gas', 'SecureParking', 'AlarmSystem', 'Intercom', 'Bath', 'Dishwasher', 'Study']","PARRAMATTA'S TALLEST RIVERFRONT TOWER!!
FOR SALES!!!",2016912226.0,-33.8135567,151.0034,https://bucket-api.domain.com.au/v1/bucket/image/2017047155_2_1_210602_065910-w1375-h499,2150,"$663,000 - $1,232,000",,PARRAMATTA,NewApartments,https://www.domain.com.au/parramatta-2150-2016912226,https://www.domain.com.au/parramatta-nsw-2150-2016912226,2021-07-10,663000.0,1232000.0
"203/6 River Rd West, Parramatta",2.0,2.0,1,<b></b><br />Riviera apartments are located in a unique waterside location right on the banks of the Parramatta River. The complex provides a resort style living environment. You will love the apartment's stylish interior design along with the natural ...,"['AirConditioning', 'BuiltInWardrobes', 'Ensuite', 'Gas', 'Intercom', 'Dishwasher']",Modern 2 Bedroom Apartment with Massive Balcony,2017047721.0,-33.81647,151.018967,https://bucket-api.domain.com.au/v1/bucket/image/2015497329_1_1_190801_075213-w960-h640,2150,"PRICE GUIDE $650,000 To $670,000",203/6 River Rd West,PARRAMATTA,ApartmentUnitFlat,https://www.domain.com.au/203-6-river-rd-west--parramatta-2150-2017047721,https://www.domain.com.au/203-6-river-rd-west-parramatta-nsw-2150-2017047721,2021-07-10,650000.0,670000.0
Parramatta,2.0,2.0,1,"<b></b><br />The 67 level glass tower is the tallest riverfront building ever to grace Parramatta's skies offering panoramic views from almost every apartment.
The Parramatta free shuttle bus service is located on your doorstep and the upgraded Parrama...","['AirConditioning', 'BuiltInWardrobes', 'CableOrSatellite', 'Ensuite', 'Gas', 'SecureParking', 'AlarmSystem', 'Intercom', 'Bath', 'Dishwasher', 'Study']","PARRAMATTA'S TALLEST RIVERFRONT TOWER!!
FOR SALES!!!",2017047155.0,-33.8135567,151.0034,https://bucket-api.domain.com.au/v1/bucket/image/2017047155_1_1_210602_065910-w4134-h2760,2150,"$663,000 - $1,232,000",,PARRAMATTA,ApartmentUnitFlat,https://www.domain.com.au/parramatta-2150-2017047155,https://www.domain.com.au/parramatta-nsw-2150-2017047155,2021-07-10,663000.0,1232000.0
"1601/88 Church Street, Parramatta",2.0,2.0,1,"<b></b><br />Raising the benchmark for luxury living, this apartment is designed to optimize space and comfort. It is set in the ultra-convenient 'West Village' complex. Situated only moments to transport, Westfield Shopping Centre and a host of trendy...","['AirConditioning', 'BuiltInWardrobes', 'Ensuite', 'Floorboards', 'InternalLaundry', 'CityViews', 'Intercom', 'BroadbandInternetAccess', 'Heating', 'Dishwasher', 'Study', 'DoubleGlazedWindows', 'BalconyDeck']",Just Listed Luxury Two Bedrooms plus Study in Parramatta CBD,2017044857.0,-33.8197975,151.004211,https://bucket-api.domain.com.au/v1/bucket/image/2017044857_1_1_210601_124808-w1000-h563,2150,Contact Agent,Church Street,PARRAMATTA,ApartmentUnitFlat,https://www.domain.com.au/1601-88-church-street--parramatta-2150-2017044857,https://www.domain.com.au/1601-88-church-street-parramatta-nsw-2150-2017044857,2021-07-10,,
"801/118 Church Street, Parramatta",2.0,2.0,1,"<b></b><br />Enjoy a panoramic outlook from the balcony of this modern apartment set on the eighth floor of a sought-after residential complex. It is ideally located in the thriving heart of bustling Parramatta CBD, walking distance to all major amenit...","['BuiltInWardrobes', 'Ensuite', 'Intercom', 'Dishwasher']",Contemporary living right in the heart of the CBD,2017042214.0,-33.81856,151.00412,https://bucket-api.domain.com.au/v1/bucket/image/2017042214_1_1_210531_061437-w1600-h1200,2150,Contact Agent,Church Street,PARRAMATTA,ApartmentUnitFlat,https://www.domain.com.au/801-118-church-street--parramatta-2150-2017042214,https://www.domain.com.au/801-118-church-street-parramatta-nsw-2150-2017042214,2021-07-10,,
"1407/88 Church Street, Parramatta",2.0,2.0,1,"<b></b><br />Developed by Ecoworld and built by Park View. Homeowners and investors, who are looking for executive lifestyle home/investment should not miss this opportunity. The new apartments are located at the perfect city CBD location with walking ...","['AirConditioning', 'BuiltInWardrobes', 'Ensuite', 'Floorboards', 'Gas', 'InternalLaundry', 'PetsAllowed', 'GroundFloor', 'Intercom', 'BroadbandInternetAccess', 'Bath', 'Heating', 'Dishwasher', 'DoubleGlazedWindows', 'EnergyEfficientAppliances', 'WaterEfficientAppliances']",Brand New Oversized 2-Bed Apartment in Parramatta CBD,2017038689.0,-33.8197975,151.004211,https://bucket-api.domain.com.au/v1/bucket/image/2016960964_1_1_210523_105130-w1920-h1280,2150,Contact Agent,Church Street,PARRAMATTA,ApartmentUnitFlat,https://www.domain.com.au/1407-88-church-street--parramatta-2150-2017038689,https://www.domain.com.au/1407-88-church-street-parramatta-nsw-2150-2017038689,2021-07-10,,
"1601/88 Church Street, Parramatta",2.0,2.0,1,"<b></b><br />Centrally located in Parramatta, this newly built apartment comes with a study room and a large size balcony facing the Church Street. Just about 5 minute walk to Parramatta Train Station and Westfield shopping centre. This building is a p...","['AirConditioning', 'BuiltInWardrobes', 'Ensuite', 'Floorboards', 'Gas', 'InternalLaundry', 'PetsAllowed', 'SecureParking', 'GroundFloor', 'Intercom', 'BroadbandInternetAccess', 'Bath', 'Heating', 'Dishwasher', 'Study', 'BalconyDeck']","Motivated Vendor, Must Sell!",2017037549.0,-33.8197975,151.004211,https://bucket-api.domain.com.au/v1/bucket/image/2016484824_14_1_200909_083139-w800-h600,2150,"Motivated Vendor, Contact Agent",Church Street,PARRAMATTA,ApartmentUnitFlat,https://www.domain.com.au/1601-88-church-street--parramatta-2150-2017037549,https://www.domain.com.au/1601-88-church-street-parramatta-nsw-2150-2017037549,2021-07-10,,
"Lv19/23 Hassall Street, Parramatta",2.0,2.0,1,"<b></b><br />BRAND NEW AND READY TO MOVE IN APARTMENT IN ULTRA CONVENIENT LOCATION WALKING DISTANCE TO PARRAMATTA SQUARE AND ALL VIBRANT RESTAURANTS 

Please Call on 0410 272 579 for a private inspection 

2bedroom 
2bathroom 
1carpark 
99sqm total

En...","['AirConditioning', 'BuiltInWardrobes', 'Ensuite', 'Gas', 'Dishwasher']",Amazing Opportunity for first homebuyer! Great Price and location,2017017558.0,-33.81836,151.014236,https://bucket-api.domain.com.au/v1/bucket/image/2017017558_1_1_210519_094704-w1600-h1067,2150,Just Listed! AFFORDABLE LUXURY,Hassall Street,PARRAMATTA,ApartmentUnitFlat,https://www.domain.com.au/lv19-23-hassall-street--parramatta-2150-2017017558,https://www.domain.com.au/lv19-23-hassall-street-parramatta-nsw-2150-2017017558,2021-07-10,,
"2703/11 Hassall Street, Parramatta",2.0,2.0,1,"<b></b><br />The nearly new apartment on 27th level, with panoramic views of Parramatta CBD and surrounding skyline, offers a luxurious lifestyle in the heart of Parramatta; it presents a rare opportunity for owner-occupant to secure an enviable modern...","['AirConditioning', 'BuiltInWardrobes', 'Ensuite', 'InternalLaundry', 'CityViews', 'Gym', 'AlarmSystem', 'Intercom', 'Dishwasher']","Wonderful nearly new 2 bedroom 2 Bath +1 parking with PANORAMIC WATER AND CITY VIEW for sale IN THE HEART OF PARRAMATTA ""SKYRISE""",2017015873.0,-33.81812,151.00827,https://bucket-api.domain.com.au/v1/bucket/image/2017015873_1_1_210519_035848-w1200-h800,2150,Price Guide $760K - $790K,Hassall Street,PARRAMATTA,ApartmentUnitFlat,https://www.domain.com.au/2703-11-hassall-street--parramatta-2150-2017015873,https://www.domain.com.au/2703-11-hassall-street-parramatta-nsw-2150-2017015873,2021-07-10,,
"49/21 Sorrell  Street, Parramatta",2.0,3.0,1,"<b></b><br />Meticulously Refurbished Three Bedroom Unit + Storage cage 
This three-bedroom apartment features bright interiors and a spacious open plan with a dual aspect. The living and dining room lead through to the modern kitchen and down the hall...","['AirConditioning', 'BuiltInWardrobes', 'Ensuite', 'Bath']",LARGE APARTMENT 121 SQM2  WITH TWO BALCONIES,2017001806.0,-33.8092,151.006683,https://bucket-api.domain.com.au/v1/bucket/image/2017001806_1_1_210512_105143-w1499-h1000,2150,"$759,000",Sorrell  Street,PARRAMATTA,ApartmentUnitFlat,https://www.domain.com.au/49-21-sorrell--street--parramatta-2150-2017001806,https://www.domain.com.au/49-21-sorrell-street-parramatta-nsw-2150-2017001806,2021-07-10,759000.0,759000.0
"1309/45 Macquarie Street, Parramatta",2.0,2.0,1,"<b></b><br />*** COVID RESTRICTIONS ***
*** From 28/06/2021 to 09/07/2021
*** Inspection by appointment only! ***
*** 
*** Please book in with Leon on 0410 538 011
*** or Jim on 0455671 314
*** 
*** Wearing a face mask is mandatory throughout th...","['AirConditioning', 'BuiltInWardrobes', 'Ensuite', 'Gas', 'InternalLaundry', 'SecureParking', 'SwimmingPool', 'Gym', 'AlarmSystem', 'Intercom', 'BroadbandInternetAccess', 'Bath', 'Dishwasher']",Two-bedroom apartment in the heart of Parramatta CBD for sale!,2017000342.0,-33.81484,151.001251,https://bucket-api.domain.com.au/v1/bucket/image/2017000342_1_1_210512_051532-w1086-h724,2150,Contact Agent for Price,Macquarie Street,PARRAMATTA,ApartmentUnitFlat,https://www.domain.com.au/1309-45-macquarie-street--parramatta-2150-2017000342,https://www.domain.com.au/1309-45-macquarie-street-parramatta-nsw-2150-2017000342,2021-07-10,,
"U603/88 Church St, Parramatta",2.0,2.0,1,"<b></b><br />There is a modern & luxury living: 'West Village'. Situated at the very heart of Parramatta, this two bedroom apartment offers the best location and best convenience to its residents. 

Main features:
- Only 200 meters from the modern P...","['AirConditioning', 'BuiltInWardrobes', 'Floorboards', 'Gas', 'InternalLaundry', 'SecureParking', 'AlarmSystem', 'Intercom', 'Dishwasher', 'BalconyDeck']",Brand new 2 bedroom apartment in the heart of the Parramatta,2016979792.0,-33.8197975,151.004211,https://bucket-api.domain.com.au/v1/bucket/image/2016931436_7_1_210413_053941-w936-h702,2150,Last Lucky Price Calling First Home Buyer,Church St,PARRAMATTA,ApartmentUnitFlat,https://www.domain.com.au/u603-88-church-st--parramatta-2150-2016979792,https://www.domain.com.au/u603-88-church-st-parramatta-nsw-2150-2016979792,2021-07-10,,
"3501/11 Hassall Street, Parramatta",2.0,2.0,1,"<b></b><br />In the heart of Parramatta, with magnificent views over the city, this is your perfect executive pad in the ""Skyrise"" tower. This stylish apartment has two large bedrooms, and an open-plan living/ dining/ kitchen which leads through huge f...","['AirConditioning', 'BuiltInWardrobes', 'Ensuite', 'Gas', 'CityViews', 'Gym', 'Heating', 'Dishwasher']",Stunning views and living space,2016968852.0,-33.81812,151.00827,https://bucket-api.domain.com.au/v1/bucket/image/2016968852_1_1_210428_070648-w1200-h800,2150,Call to book private inspection,Hassall Street,PARRAMATTA,ApartmentUnitFlat,https://www.domain.com.au/3501-11-hassall-street--parramatta-2150-2016968852,https://www.domain.com.au/3501-11-hassall-street-parramatta-nsw-2150-2016968852,2021-07-10,,
"4/55 Rosehill Street, Parramatta",2.0,3.0,2,"<b></b><br />Enviably positioned within the boutique 'Mia' complex and featuring luxury inclusions throughout, this master-built townhouse is moments from the vibrant Parramatta CBD entertainment precinct, train station, bus stops, Westfield Shoppingto...","['BuiltInWardrobes', 'Ensuite', 'Gas', 'InternalLaundry', 'SecureParking', 'Bath', 'Study']",Tri-level Townhouse,2016966053.0,-33.824398,151.00116,https://bucket-api.domain.com.au/v1/bucket/image/2016966053_1_1_210428_122153-w4500-h3000,2150,"$850,000-$900,000",Rosehill Street,PARRAMATTA,Townhouse,https://www.domain.com.au/4-55-rosehill-street--parramatta-2150-2016966053,https://www.domain.com.au/4-55-rosehill-street-parramatta-nsw-2150-2016966053,2021-07-10,,
