add,bath,bed,car,desc,features,headline,id,lat,lon,photo,postcode,price,street,suburb,type,url,url2,date,min_price,max_price
"34b Daruga Avenue, Pemulwuy",3.0,4.0,2,"<b></b><br />Enjoying the perfect park side location looking across to the manicured walking tracks and gardens in leafy Marrong Reserve, here is a wonderfully private stand-alone residence on a grand corner position high up in premium Pemulwuy.  Featu...","['AirConditioning', 'BuiltInWardrobes', 'Ensuite', 'Gas', 'SecureParking']","PARKSIDE CORNER POSITION, MODERN LIVING",2017041523.0,-33.8191528,150.926666,https://bucket-api.domain.com.au/v1/bucket/image/2017041523_1_1_210531_034749-w750-h500,2145,"Price Guide $850,000 - $900,000",Daruga Avenue,PEMULWUY,House,https://www.domain.com.au/34b-daruga-avenue--pemulwuy-2145-2017041523,https://www.domain.com.au/34b-daruga-avenue-pemulwuy-nsw-2145-2017041523,2021-07-10,850000.0,900000.0
"2/183 Targo  Road, Girraween",2.0,3.0,1,"<b></b><br />Excellent opportunity to purchase a three-bedroom villa situated in the heart of Girraween. Set in a highly desirable pocket, this home is within close proximity to local buses, Pendle Hill shops, Portico plaza shopping centre, Girraween r...","['AirConditioning', 'BuiltInWardrobes', 'Ensuite', 'Gas', 'InternalLaundry', 'SecureParking', 'AlarmSystem', 'Heating', 'Dishwasher', 'FullyFenced', 'RainwaterStorageTank']",Delightful Family Abode in Girraween School Catchment,2017037528.0,-33.7953262,150.951965,https://bucket-api.domain.com.au/v1/bucket/image/2017037528_1_1_210528_025549-w1920-h1280,2145,"$780,000 - $820,000",Targo  Road,GIRRAWEEN,Villa,https://www.domain.com.au/2-183-targo--road--girraween-2145-2017037528,https://www.domain.com.au/2-183-targo-road-girraween-nsw-2145-2017037528,2021-07-10,780000.0,820000.0
"81/127 Park  Road, Rydalmere",2.0,3.0,2,"<b></b><br />You must inspect this double brick townhouse positioned along the Rydalmere/Dundas border, in a secure and convenient complex. Developed By MERITON!
Offering a north-south aspect, spacious floor plan and a double lock-up garage, this dual ...","['BuiltInWardrobes', 'Ensuite', 'InternalLaundry', 'SecureParking', 'SwimmingPool', 'Furnished', 'GroundFloor', 'NorthFacing', 'TennisCourt']",Sold In 2 Weeks!,2017037441.0,-33.8068352,151.043777,https://bucket-api.domain.com.au/v1/bucket/image/2017037441_1_1_210528_023630-w1920-h1280,2116,"$860,000 - $890,000",Park  Road,RYDALMERE,Townhouse,https://www.domain.com.au/81-127-park--road--rydalmere-2116-2017037441,https://www.domain.com.au/81-127-park-road-rydalmere-nsw-2116-2017037441,2021-07-10,860000.0,890000.0
"5A/13-15 Normac Rd, Girraween",3.0,3.0,1,"<b></b><br />Proudly offering to the housing market is this exceptionally designed, off the plan, torrens title, attached duplex in the heart and soul of Girraween! It's almost nearing the completion date and waiting for you to call it home!

This st...","['AirConditioning', 'BuiltInWardrobes', 'Ensuite', 'Gas', 'InternalLaundry', 'SecureParking', 'Dishwasher', 'BalconyDeck']",IMPECCABLE DESIGN!,2017036985.0,-33.79762,150.945251,https://bucket-api.domain.com.au/v1/bucket/image/2017036938_1_1_210528_122733-w3382-h1903,2145,Contact Agent,Normac Rd,GIRRAWEEN,Duplex,https://www.domain.com.au/5a-13-15-normac-rd--girraween-2145-2017036985,https://www.domain.com.au/5a-13-15-normac-rd-girraween-nsw-2145-2017036985,2021-07-10,,
"5/13-15 Normac Rd, Girraween",3.0,3.0,1,"<b></b><br />Proudly offering to the housing market is this exceptionally designed, off the plan, torrens title, attached duplex in the heart and soul of Girraween! It's almost nearing the completion date and waiting for you to call it home!

This st...","['AirConditioning', 'BuiltInWardrobes', 'Ensuite', 'Gas', 'InternalLaundry', 'SecureParking', 'Dishwasher', 'BalconyDeck']",IMPECCABLE DESIGN!,2017036973.0,-33.79762,150.945251,https://bucket-api.domain.com.au/v1/bucket/image/2017036938_1_1_210528_122733-w3382-h1903,2145,Contact Agent,Normac Rd,GIRRAWEEN,Duplex,https://www.domain.com.au/5-13-15-normac-rd--girraween-2145-2017036973,https://www.domain.com.au/5-13-15-normac-rd-girraween-nsw-2145-2017036973,2021-07-10,,
"3/13-15 Normac Rd, Girraween",3.0,3.0,1,"<b></b><br />Proudly offering to the housing market is this exceptionally designed, off the plan, torrens title, freestanding duplex in the heart and soul of Girraween! It's almost nearing the completion date and waiting for you to call it home!

Thi...","['AirConditioning', 'BuiltInWardrobes', 'Ensuite', 'Gas', 'InternalLaundry', 'SecureParking', 'Dishwasher', 'BalconyDeck']",IMPECCABLE DESIGN!,2017036958.0,-33.79762,150.945251,https://bucket-api.domain.com.au/v1/bucket/image/2017036938_1_1_210528_122733-w3382-h1903,2145,Contact Agent,Normac Rd,GIRRAWEEN,Duplex,https://www.domain.com.au/3-13-15-normac-rd--girraween-2145-2017036958,https://www.domain.com.au/3-13-15-normac-rd-girraween-nsw-2145-2017036958,2021-07-10,,
"2/13-15 Normac Rd, Girraween",3.0,3.0,1,"<b></b><br />Proudly offering to the housing market is this exceptionally designed, off the plan, torrens title, freestanding duplex in the heart and soul of Girraween! It's almost nearing the completion date and waiting for you to call it home!

Thi...","['AirConditioning', 'BuiltInWardrobes', 'Ensuite', 'Gas', 'InternalLaundry', 'SecureParking', 'Dishwasher']",IMPECCABLE DESIGN!,2017036951.0,-33.79762,150.945251,https://bucket-api.domain.com.au/v1/bucket/image/2017036938_1_1_210528_122733-w3382-h1903,2145,Contact Agent,Normac Rd,GIRRAWEEN,Duplex,https://www.domain.com.au/2-13-15-normac-rd--girraween-2145-2017036951,https://www.domain.com.au/2-13-15-normac-rd-girraween-nsw-2145-2017036951,2021-07-10,,
"1/13-15 Normac Rd, Girraween",3.0,3.0,1,"<b></b><br />Proudly offering to the housing market is this exceptionally designed, off the plan, torrens title, freestanding duplex in the heart and soul of Girraween! It's almost nearing the completion date and waiting for you to call it home!

Thi...","['AirConditioning', 'BuiltInWardrobes', 'Gas', 'InternalLaundry', 'SecureParking', 'Intercom', 'Dishwasher', 'Study', 'BalconyDeck']",IMPECCABLE DESIGN!,2017036938.0,-33.79762,150.945251,https://bucket-api.domain.com.au/v1/bucket/image/2017036938_1_1_210528_122733-w3382-h1903,2145,Contact Agent,Normac Rd,GIRRAWEEN,Duplex,https://www.domain.com.au/1-13-15-normac-rd--girraween-2145-2017036938,https://www.domain.com.au/1-13-15-normac-rd-girraween-nsw-2145-2017036938,2021-07-10,,
"200 Marsden Road, Dundas Valley",3.0,4.0,4,"<b></b><br />With amazing view of Parramatta CBD is this 4 bedroom weatherboard home set on a large 840sqm block of land. Conveniently located with easy access to Eastwood shops, restaurants and train station. This is an ideal property for a family hom...","['Ensuite', 'InternalLaundry']",840sqm Block with 20m Frontage,2017035765.0,-33.791996,151.066,https://bucket-api.domain.com.au/v1/bucket/image/2017035765_1_1_210527_063959-w3800-h2533,2117,Contact Agent,Marsden Road,DUNDAS VALLEY,House,https://www.domain.com.au/200-marsden-road--dundas-valley-2117-2017035765,https://www.domain.com.au/200-marsden-road-dundas-valley-nsw-2117-2017035765,2021-07-10,,
"36/6-10 Ettalong Road, Greystanes",2.0,3.0,2,"<b></b><br />HAUS Property Group proud to presents this fantastic opportunity to secure this single level Freshly painted 3 bedrooms Villa located in an established complex, you will find this immaculately presented north facing villa boasting private ...","['AirConditioning', 'BuiltInWardrobes', 'Gas', 'InternalLaundry', 'SecureParking', 'NorthFacing']",Large 3 Bedroom Villa,2017034987.0,-33.81296,150.953232,https://bucket-api.domain.com.au/v1/bucket/image/2017034987_1_1_210527_042059-w4000-h2667,2145,JUST LISTED,Ettalong Road,GREYSTANES,House,https://www.domain.com.au/36-6-10-ettalong-road--greystanes-2145-2017034987,https://www.domain.com.au/36-6-10-ettalong-road-greystanes-nsw-2145-2017034987,2021-07-10,,
"10A & 10B Eddy  Street, Merrylands",3.0,4.0,1,"<b></b><br />Beautifully designed to accommodate luxury family living and entertaining, these near new 2 x 4 bedrooms executive duplexes are defined by the impressive level of care given to both its sophisticated form and function.

The moment you open...","['AirConditioning', 'Ensuite', 'Gas', 'SecureParking', 'Intercom', 'Dishwasher', 'FullyFenced']","""Choice of Two Modern Duplex Home - Torrens Title""",2017033594.0,-33.8350563,150.9596,https://bucket-api.domain.com.au/v1/bucket/image/2017033594_1_1_210526_010253-w1920-h1280,2160,"For Sale-Price Guide $895,000-$980,000 each",Eddy  Street,MERRYLANDS,SemiDetached,https://www.domain.com.au/10a-&-10b-eddy--street--merrylands-2160-2017033594,https://www.domain.com.au/10a-10b-eddy-street-merrylands-nsw-2160-2017033594,2021-07-10,,
"59A Fowler Road, Merrylands West",2.0,4.0,2,"<b></b><br />Call to Book An Inspection Time

Hash Soultani and Peter Kwaramba from Laing and Simmons Blacktown are proud to present this beautiful family home. This beautiful 4 bedroom charm offers modern living and design, ideal for first home or a t...","['AirConditioning', 'Ensuite', 'Gas', 'SecureParking', 'SwimmingPool', 'Furnished']","Convenient, Spacious and Modern Family Home - Call to Book An Inspection Time",2017032678.0,-33.8385544,150.975571,https://bucket-api.domain.com.au/v1/bucket/image/2017032678_1_1_210526_061423-w2400-h1600,2160,"Price Guide: $800,000",Fowler Road,MERRYLANDS WEST,SemiDetached,https://www.domain.com.au/59a-fowler-road--merrylands-west-2160-2017032678,https://www.domain.com.au/59a-fowler-road-merrylands-west-nsw-2160-2017032678,2021-07-10,800000.0,800000.0
"51a Girraween Road, Girraween",3.0,4.0,2,"<b></b><br />First National Westsyde (Pendle Hill) is proud to present this immaculately presented, freshly painted and spacious duplex positioned in a prime spot of Girraween. Situated only minutes' walk to reputed Girraween public & high schools and ...","['AirConditioning', 'BuiltInWardrobes', 'Ensuite', 'Gas', 'InternalLaundry', 'SecureParking', 'AlarmSystem', 'Intercom', 'FullyFenced']",Torrens Title Duplex in Girraween School Catchment!!,2017029760.0,-33.7964821,150.947449,https://bucket-api.domain.com.au/v1/bucket/image/2017029760_1_1_210618_040137-w1920-h1280,2145,Just Listed,Girraween Road,GIRRAWEEN,SemiDetached,https://www.domain.com.au/51a-girraween-road--girraween-2145-2017029760,https://www.domain.com.au/51a-girraween-road-girraween-nsw-2145-2017029760,2021-07-10,,
"337a Clyde Street, South Granville",3.0,4.0,2,"<b></b><br />Architecturally designed, Frank La Malfa presents this luxury 4 bedroom duplex.

This contemporary style home has everything a family needs and more. Made with quality materials from the Vitrabond exterior to the Italian bathroom fittings ...","['AirConditioning', 'BuiltInWardrobes', 'Floorboards', 'Gas', 'SecureParking', 'Study']",MODERN SPACIOUS HOUSE,2017029066.0,-33.86117,151.010345,https://bucket-api.domain.com.au/v1/bucket/image/2017029066_1_1_210525_053326-w1600-h1068,2142,SOLD I Frank La Malfa,Clyde Street,SOUTH GRANVILLE,House,https://www.domain.com.au/337a-clyde-street--south-granville-2142-2017029066,https://www.domain.com.au/337a-clyde-street-south-granville-nsw-2142-2017029066,2021-07-10,,
"10 Rubina  Street, Merrylands",3.0,4.0,1,"<b></b><br />A statement in low maintenance contemporary living, this beautiful architecturally designed duplex optimises space and natural light over a tastefully styled open plan flowing layout.

Showcasing a stylish kitchen, quality stainless steel ...","['AirConditioning', 'BuiltInWardrobes', 'Ensuite', 'SecureParking', 'AlarmSystem', 'Intercom', 'Bath']",TORRENS TITLE DUPLEX,2017028025.0,-33.8343353,150.97406,https://bucket-api.domain.com.au/v1/bucket/image/2017028025_1_1_210525_021019-w3000-h2000,2160,"$750,000-$790,000",Rubina  Street,MERRYLANDS,SemiDetached,https://www.domain.com.au/10-rubina--street--merrylands-2160-2017028025,https://www.domain.com.au/10-rubina-street-merrylands-nsw-2160-2017028025,2021-07-10,,
"10A Rubina  Street, Merrylands",3.0,4.0,1,"<b></b><br />A statement in low maintenance contemporary living, this beautiful architecturally designed duplex optimises space and natural light over a tastefully styled open plan flowing layout.

Showcasing a stylish kitchen, quality stainless steel ...","['AirConditioning', 'BuiltInWardrobes', 'Ensuite', 'SecureParking', 'Intercom', 'Bath']",ONE OF THE FINEST YOU WILL SEE,2017027842.0,-33.8343353,150.97406,https://bucket-api.domain.com.au/v1/bucket/image/2017027842_1_1_210525_013218-w3000-h2000,2160,CONTACT AGENT,Rubina  Street,MERRYLANDS,SemiDetached,https://www.domain.com.au/10a-rubina--street--merrylands-2160-2017027842,https://www.domain.com.au/10a-rubina-street-merrylands-nsw-2160-2017027842,2021-07-10,,
"95 The Trongate, Granville",2.0,3.0,2,"<b></b><br />The Phone Code for this property is: 64859. Please quote this number when phoning or texting.

Beautifully presented three bedroom home with tiled floors throughout. Situated on a easy care corner block with dual street access. 

Featu...","['AirConditioning', 'BuiltInWardrobes', 'Gas', 'SecureParking', 'Shed', 'FullyFenced']",Beautiful 3 Bedroom Family home on a Corner Block,2017023471.0,-33.8409538,151.012543,https://bucket-api.domain.com.au/v1/bucket/image/2017023471_1_1_210521_120125-w1920-h1440,2142,Just Listed,The Trongate,GRANVILLE,House,https://www.domain.com.au/95-the-trongate--granville-2142-2017023471,https://www.domain.com.au/95-the-trongate-granville-nsw-2142-2017023471,2021-07-10,,
"8/25 Tungarra Rd, Girraween",2.0,3.0,1,"<b></b><br />Though the environment has changed, delivering great results remains the same! Call or email today to arrange a private 1:1 viewing. We request you wear a mask and maintain 1.5 metre social distancing. Hand sanitizer will be available.

...","['AirConditioning', 'BuiltInWardrobes', 'Ensuite', 'Gas', 'Study', 'RainwaterStorageTank']","Girraween Public Catchment, low maintenance and quiet, family friendly location!",2017020095.0,-33.79711,150.948959,https://bucket-api.domain.com.au/v1/bucket/image/2017020095_1_1_210520_060026-w2400-h1599,2145,"$749,000",Tungarra Rd,GIRRAWEEN,Villa,https://www.domain.com.au/8-25-tungarra-rd--girraween-2145-2017020095,https://www.domain.com.au/8-25-tungarra-rd-girraween-nsw-2145-2017020095,2021-07-10,749000.0,749000.0
"31/16 Carson Street, Dundas Valley",2.0,3.0,2,<b></b><br />Step inside from your own private entrance to discover an impressive family home truly like no other! Bathed in natural light this contemporary property delivers epic proportions. The open plan living and dining areas flow seamlessly to th...,"['AirConditioning', 'BuiltInWardrobes', 'Ensuite', 'InternalLaundry', 'PetsAllowed', 'SecureParking', 'GroundFloor', 'Bath', 'Dishwasher', 'Study', 'FullyFenced', 'GardenCourtyard', 'BalconyDeck']",SOLD - Oversized townhouse offers perfect family home,2017019442.0,-33.7957764,151.063828,https://bucket-api.domain.com.au/v1/bucket/image/2017019442_1_1_210604_082638-w3913-h3899,2117,Contact Agent,Carson Street,DUNDAS VALLEY,Townhouse,https://www.domain.com.au/31-16-carson-street--dundas-valley-2117-2017019442,https://www.domain.com.au/31-16-carson-street-dundas-valley-nsw-2117-2017019442,2021-07-10,,
"6/95 Kissing Point Road, Dundas",3.0,3.0,2,"<b></b><br />Light, bright and well maintained throughout, this private townhouse presents a great opportunity for first home buyers, downsizers and investors alike. 

Set in a peaceful complex, the property features:
- 3 good size bedrooms (all with b...","['BuiltInWardrobes', 'Ensuite', 'Gas', 'InternalLaundry', 'SecureParking', 'Bath']",Full Brick Family Home,2017018592.0,-33.8036537,151.037262,https://bucket-api.domain.com.au/v1/bucket/image/2017018592_1_1_210520_012955-w1500-h1000,2117,"Buyers Guide $899,990",Kissing Point Road,DUNDAS,Townhouse,https://www.domain.com.au/6-95-kissing-point-road--dundas-2117-2017018592,https://www.domain.com.au/6-95-kissing-point-road-dundas-nsw-2117-2017018592,2021-07-10,899990.0,899990.0
"11/27-29 Tungarra Road, Girraween",3.0,3.0,1,"<b></b><br />Brand new architecturally designed townhouse showcasing an enviable lifestyle set within a quiet, leafy street and only 5 minutes walk to both Girraween Selective High School and Girraween Public School. 

Features 

Bespoke designed kitch...","['AirConditioning', 'BuiltInWardrobes', 'Ensuite', 'Floorboards', 'Gas', 'Dishwasher']",Brand New 3 Bedroom Townhouse- Available For Immediate Occupation,2017016050.0,-33.7969437,150.948853,https://bucket-api.domain.com.au/v1/bucket/image/2017016050_1_1_210519_043221-w1200-h800,2145,Contact Agent,Tungarra Road,GIRRAWEEN,Townhouse,https://www.domain.com.au/11-27-29-tungarra-road--girraween-2145-2017016050,https://www.domain.com.au/11-27-29-tungarra-road-girraween-nsw-2145-2017016050,2021-07-10,,
"141A Lackey Street, Merrylands",2.0,3.0,2,"<b></b><br />All the elements for family living are delivered in a comfortable lifestyle package with this quality Master built home. Set in a peaceful location, convenient and well maintained 3-bedroom brick home, open plan, double carport. Your priva...","['AirConditioning', 'BuiltInWardrobes', 'InternalLaundry', 'PetsAllowed', 'GroundFloor', 'BroadbandInternetAccess', 'Bath', 'Study', 'Shed', 'FullyFenced', 'GardenCourtyard']",Comfortable home with a perfectly quiet location,2017001855.0,-33.8453979,150.999039,https://bucket-api.domain.com.au/v1/bucket/image/2017001855_1_1_210517_115549-w1343-h889,2160,CONTACT AGENT,Lackey Street,MERRYLANDS,House,https://www.domain.com.au/141a-lackey-street--merrylands-2160-2017001855,https://www.domain.com.au/141a-lackey-street-merrylands-nsw-2160-2017001855,2021-07-10,,
"3/7 Wirralee Street, South Wentworthville",2.0,3.0,1,"<b></b><br />Positioned in a stylishly modern and beautifully maintained complex, here is a lovely three bedroom townhouse offering a clever and highly functional floor plan for the new owners. Boasting multi-zone ducted air-conditioning, high ceilings...","['AirConditioning', 'BuiltInWardrobes', 'Ensuite', 'Gas', 'Intercom']","MODERN, FRESH AND FUNCTIONAL",2017010900.0,-33.82366,150.967148,https://bucket-api.domain.com.au/v1/bucket/image/2017010900_1_1_210517_074309-w750-h499,2145,"Price Guide $695,000 - $725,000",Wirralee Street,SOUTH WENTWORTHVILLE,Townhouse,https://www.domain.com.au/3-7-wirralee-street--south-wentworthville-2145-2017010900,https://www.domain.com.au/3-7-wirralee-street-south-wentworthville-nsw-2145-2017010900,2021-07-10,695000.0,725000.0
"10B Rubina  Street, Merrylands",3.0,4.0,1,"<b></b><br />A statement in low maintenance contemporary living, this beautiful architecturally designed duplex optimises space and natural light over a tastefully styled open plan flowing layout.

Showcasing a stylish kitchen, quality stainless steel ...","['AirConditioning', 'BuiltInWardrobes', 'Ensuite', 'SecureParking', 'Bath', 'Heating']",STUNNING 4 BEDROOM DUPLEX,2017010854.0,-33.8343353,150.97406,https://bucket-api.domain.com.au/v1/bucket/image/2017010854_1_1_210517_073050-w3000-h2000,2160,"$750,000-$790,000",Rubina  Street,MERRYLANDS,SemiDetached,https://www.domain.com.au/10b-rubina--street--merrylands-2160-2017010854,https://www.domain.com.au/10b-rubina-street-merrylands-nsw-2160-2017010854,2021-07-10,,
"201/7 Maple Tree Road, Westmead",2.0,2.0,1,"<b></b><br />Highline, the first stage of Deicorp's landmark project Westmead Rise, sets a new standard of apartment living. This brilliantly conceived residential community offers you a home without peer, where you'll be part of a beautifully landscap...","['AirConditioning', 'InternalLaundry', 'SwimmingPool', 'Intercom', 'Study']",LIVE THE HIGH LIFE,2017010103.0,-33.8071671,150.985977,https://bucket-api.domain.com.au/v1/bucket/image/2013819812_1_1_210310_022409-w6000-h4000,2145,"$778,000",Maple Tree Road,WESTMEAD,NewApartments,https://www.domain.com.au/201-7-maple-tree-road--westmead-2145-2017010103,https://www.domain.com.au/201-7-maple-tree-road-westmead-nsw-2145-2017010103,2021-07-10,778000.0,778000.0
"202/7 Maple Tree Road, Westmead",2.0,2.0,1,"<b></b><br />Highline, the first stage of Deicorp's landmark project Westmead Rise, sets a new standard of apartment living. This brilliantly conceived residential community offers you a home without peer, where you'll be part of a beautifully landscap...","['AirConditioning', 'InternalLaundry', 'SwimmingPool', 'Intercom', 'Study']",LIVE THE HIGH LIFE,2017010072.0,-33.8071671,150.985977,https://bucket-api.domain.com.au/v1/bucket/image/2013822422_1_1_210310_022408-w5928-h3952,2145,"$831,000",Maple Tree Road,WESTMEAD,ApartmentUnitFlat,https://www.domain.com.au/202-7-maple-tree-road--westmead-2145-2017010072,https://www.domain.com.au/202-7-maple-tree-road-westmead-nsw-2145-2017010072,2021-07-10,831000.0,831000.0
"621/7 Maple Tree Road, Westmead",2.0,2.0,1,"<b></b><br />Highline, the first stage of Deicorp's landmark project Westmead Rise, sets a new standard of apartment living. This brilliantly conceived residential community offers you a home without peer, where you'll be part of a beautifully landscap...","['AirConditioning', 'InternalLaundry', 'SwimmingPool', 'Intercom', 'Study']",LIVE THE HIGH LIFE,2017009825.0,-33.8071671,150.985977,https://bucket-api.domain.com.au/v1/bucket/image/2013822422_1_1_210310_022408-w5928-h3952,2145,"$788,500",Maple Tree Road,WESTMEAD,ApartmentUnitFlat,https://www.domain.com.au/621-7-maple-tree-road--westmead-2145-2017009825,https://www.domain.com.au/621-7-maple-tree-road-westmead-nsw-2145-2017009825,2021-07-10,788500.0,788500.0
"136/40 Strathalbyn Drive, Oatlands",2.0,3.0,2,"<b></b><br />Finely positioned on one of Oatlands most prestigious tree-lined community is this quintessential family entertainer. This brick townhouse boasts a sleek indoor/outdoor layout with quality finishes. It is ideal for young executives, famili...","['AirConditioning', 'BuiltInWardrobes', 'Ensuite', 'Floorboards', 'InternalLaundry', 'SecureParking', 'SwimmingPool', 'Intercom', 'Dishwasher', 'TennisCourt', 'GardenCourtyard', 'BalconyDeck']",Ultimate Family Townhouse In Prestigious Lifestyle Locale,2017001853.0,-33.7977371,151.015671,https://bucket-api.domain.com.au/v1/bucket/image/2017001853_1_1_210621_023748-w1600-h1068,2117,Contact Agent,Strathalbyn Drive,OATLANDS,Townhouse,https://www.domain.com.au/136-40-strathalbyn-drive--oatlands-2117-2017001853,https://www.domain.com.au/136-40-strathalbyn-drive-oatlands-nsw-2117-2017001853,2021-07-10,,
"1204/28 Cowper Street, Granville",2.0,2.0,1,"<b></b><br />A selection of residence offering a convenient lifestyle at Granville Place apartment. It is a boutique development of an oversized 2-bed apartment, located right next to Granville Station.

This 2 bedroom developed by Shokai and Tier 1 ...","['AirConditioning', 'BuiltInWardrobes', 'Ensuite', 'Gas', 'InternalLaundry', 'SecureParking', 'GroundFloor', 'CityViews', 'Gym', 'AlarmSystem', 'Intercom', 'BroadbandInternetAccess', 'Dishwasher', 'Study', 'BalconyDeck']",Brand New Luxury Large Size 2 Bedroom plus A Study for Sale,2017002585.0,-33.8324623,151.013611,https://bucket-api.domain.com.au/v1/bucket/image/2017002585_1_1_210513_011335-w820-h547,2142,Contact Agent for price,Cowper Street,GRANVILLE,ApartmentUnitFlat,https://www.domain.com.au/1204-28-cowper-street--granville-2142-2017002585,https://www.domain.com.au/1204-28-cowper-street-granville-nsw-2142-2017002585,2021-07-10,,
"3/9 Gray Street, Granville",2.0,3.0,2,<b></b><br />Conveniently located is this renovated 3 bedroom double brick townhouse. Situated in Granville's popular northern side and with easy access to M4 and Parramatta CBD. This property is ideal for first home buyers or a great investment opport...,"['BuiltInWardrobes', 'Ensuite', 'Gas', 'InternalLaundry', 'SecureParking', 'Bath']",Renovated Townhouse  500m to Station,2016993260.0,-33.829525,151.014313,https://bucket-api.domain.com.au/v1/bucket/image/2016993260_10_1_210510_031250-w1920-h1280,2142,"$745,000",Gray Street,GRANVILLE,Townhouse,https://www.domain.com.au/3-9-gray-street--granville-2142-2016993260,https://www.domain.com.au/3-9-gray-street-granville-nsw-2142-2016993260,2021-07-10,745000.0,745000.0
"8/352-354 Merrylands Road, Merrylands",2.0,2.0,1,"<b></b><br />Boasting an exceptional layout with separate lounge, dining and family rooms, this two bedroom townhouse offers a comfortably private lifestyle for the new owners.  Featuring a quality gas kitchen with stainless steel appliances, air-condi...","['AirConditioning', 'BuiltInWardrobes', 'Ensuite', 'Gas', 'InternalLaundry', 'SecureParking']",WONDERFUL FLOORPLAN,2016993025.0,-33.8348846,150.9802,https://bucket-api.domain.com.au/v1/bucket/image/2016993025_1_1_210510_021811-w750-h499,2160,"Price Guide $640,000 - $680,000",Merrylands Road,MERRYLANDS,Townhouse,https://www.domain.com.au/8-352-354-merrylands-road--merrylands-2160-2016993025,https://www.domain.com.au/8-352-354-merrylands-road-merrylands-nsw-2160-2016993025,2021-07-10,640000.0,680000.0
"808/12 East Street, Granville",2.0,3.0,1,"<b></b><br />Great city view apartment in north east corner position

Short walk to Granville railway station 

Close to local shops, cafe and restaurant

Easy access to A4 & M4 

Apartment features

- Spacious living area and dining room
- Stylish kit...","['AirConditioning', 'BuiltInWardrobes', 'CableOrSatellite', 'SecureParking', 'CityViews', 'Intercom', 'Heating', 'Dishwasher']",North East facing 3bed apartment,2016988746.0,-33.8334579,151.014175,https://bucket-api.domain.com.au/v1/bucket/image/2016988746_1_1_210506_123930-w1200-h800,2142,Contact Agent,East Street,GRANVILLE,ApartmentUnitFlat,https://www.domain.com.au/808-12-east-street--granville-2142-2016988746,https://www.domain.com.au/808-12-east-street-granville-nsw-2142-2016988746,2021-07-10,,
